title,genre,poster,year,duration,score,description
For My Father (Sof Shavua B'Tel Aviv),Drama,http://dummyimage.com/240x180.png/dddddd/000000,1992,71,0.63,"Vestibulum quam sapien, varius ut, blandit non, interdum in, ante. Vestibulum ante ipsum primis in faucibus orci luctus et ultrices posuere cubilia Curae; Duis faucibus accumsan odio. Curabitur convallis."
WUSA,Drama,http://dummyimage.com/240x180.png/dddddd/000000,1988,119,0.49,"Proin eu mi. Nulla ac enim. In tempor, turpis nec euismod scelerisque, quam turpis adipiscing lorem, vitae mattis nibh ligula nec sem."
The Beast Kills in Cold Blood,Horror|Mystery|Thriller,http://dummyimage.com/240x180.png/cc0000/ffffff,2011,194,0.16,Pellentesque at nulla. Suspendisse potenti. Cras in purus eu magna vulputate luctus.
Being Elmo: A Puppeteer's Journey,Documentary,http://dummyimage.com/240x180.png/ff4444/ffffff,2006,124,0.49,Sed ante. Vivamus tortor. Duis mattis egestas metus.
Period of Adjustment,Comedy|Drama,http://dummyimage.com/240x180.png/ff4444/ffffff,1998,73,0.85,Duis bibendum. Morbi non quam nec dui luctus rutrum. Nulla tellus.
Blue Gold: World Water Wars,Documentary,http://dummyimage.com/240x180.png/dddddd/000000,1996,180,0.58,Nulla ut erat id mauris vulputate elementum. Nullam varius. Nulla facilisi.
"Time for Killing, A",Western,http://dummyimage.com/240x180.png/dddddd/000000,2006,194,0.16,Nulla ut erat id mauris vulputate elementum. Nullam varius. Nulla facilisi.
Harry Potter and the Deathly Hallows: Part 2,Action|Adventure|Drama|Fantasy|Mystery|IMAX,http://dummyimage.com/240x180.png/cc0000/ffffff,2010,191,0.63,Integer tincidunt ante vel ipsum. Praesent blandit lacinia erat. Vestibulum sed magna at nunc commodo placerat.
Sexy Beast,Comedy|Crime|Drama,http://dummyimage.com/240x180.png/dddddd/000000,1995,112,0.71,"Quisque id justo sit amet sapien dignissim vestibulum. Vestibulum ante ipsum primis in faucibus orci luctus et ultrices posuere cubilia Curae; Nulla dapibus dolor vel est. Donec odio justo, sollicitudin ut, suscipit a, feugiat et, eros."
Fuck,Comedy|Documentary,http://dummyimage.com/240x180.png/cc0000/ffffff,2005,153,0.31,In congue. Etiam justo. Etiam pretium iaculis justo.
"Glass House, The",Thriller,http://dummyimage.com/240x180.png/5fa2dd/ffffff,2003,97,0.42,"Maecenas leo odio, condimentum id, luctus nec, molestie sed, justo. Pellentesque viverra pede ac diam. Cras pellentesque volutpat dui."
Dark Tide,Adventure|Drama|Thriller,http://dummyimage.com/240x180.png/dddddd/000000,2012,72,0.75,In quis justo. Maecenas rhoncus aliquam lacus. Morbi quis tortor id nulla ultrices aliquet.
Afflicted,Horror|Sci-Fi|Thriller,http://dummyimage.com/240x180.png/ff4444/ffffff,1997,152,0.36,"Quisque id justo sit amet sapien dignissim vestibulum. Vestibulum ante ipsum primis in faucibus orci luctus et ultrices posuere cubilia Curae; Nulla dapibus dolor vel est. Donec odio justo, sollicitudin ut, suscipit a, feugiat et, eros."
The Real Glory,War,http://dummyimage.com/240x180.png/ff4444/ffffff,1983,137,0.67,"Curabitur gravida nisi at nibh. In hac habitasse platea dictumst. Aliquam augue quam, sollicitudin vitae, consectetuer eget, rutrum at, lorem."
Mrs. Parkington,Drama|Romance,http://dummyimage.com/240x180.png/dddddd/000000,2000,86,0.46,Pellentesque at nulla. Suspendisse potenti. Cras in purus eu magna vulputate luctus.
Gaslight,Drama|Thriller,http://dummyimage.com/240x180.png/5fa2dd/ffffff,2004,170,0.77,"Morbi porttitor lorem id ligula. Suspendisse ornare consequat lectus. In est risus, auctor sed, tristique in, tempus sit amet, sem."
"Have Rocket, Will Travel",Comedy|Sci-Fi,http://dummyimage.com/240x180.png/dddddd/000000,1993,198,0.53,Aenean lectus. Pellentesque eget nunc. Donec quis orci eget orci vehicula condimentum.
"Winning Season, The",Comedy,http://dummyimage.com/240x180.png/5fa2dd/ffffff,2011,169,0.11,"Proin interdum mauris non ligula pellentesque ultrices. Phasellus id sapien in sapien iaculis congue. Vivamus metus arcu, adipiscing molestie, hendrerit at, vulputate vitae, nisl."
Suzanne's Diary for Nicholas,Drama|Romance,http://dummyimage.com/240x180.png/ff4444/ffffff,2004,132,0.99,"Curabitur in libero ut massa volutpat convallis. Morbi odio odio, elementum eu, interdum eu, tincidunt in, leo. Maecenas pulvinar lobortis est."
Tomboy,Drama,http://dummyimage.com/240x180.png/5fa2dd/ffffff,1999,89,0.61,Aenean lectus. Pellentesque eget nunc. Donec quis orci eget orci vehicula condimentum.
Beyond the Law (Lain ulkopuolella),Crime|Drama|Thriller,http://dummyimage.com/240x180.png/cc0000/ffffff,2012,115,0.78,"Proin eu mi. Nulla ac enim. In tempor, turpis nec euismod scelerisque, quam turpis adipiscing lorem, vitae mattis nibh ligula nec sem."
The Natural Love,Documentary,http://dummyimage.com/240x180.png/cc0000/ffffff,2010,175,0.75,"In hac habitasse platea dictumst. Morbi vestibulum, velit id pretium iaculis, diam erat fermentum justo, nec condimentum neque sapien placerat ante. Nulla justo."
"Secret of Santa Vittoria, The",Comedy|Drama|War,http://dummyimage.com/240x180.png/5fa2dd/ffffff,1997,75,0.52,"Vestibulum quam sapien, varius ut, blandit non, interdum in, ante. Vestibulum ante ipsum primis in faucibus orci luctus et ultrices posuere cubilia Curae; Duis faucibus accumsan odio. Curabitur convallis."
"Art of the Steal, The",Documentary,http://dummyimage.com/240x180.png/cc0000/ffffff,1989,96,0.09,"Donec diam neque, vestibulum eget, vulputate ut, ultrices vel, augue. Vestibulum ante ipsum primis in faucibus orci luctus et ultrices posuere cubilia Curae; Donec pharetra, magna vestibulum aliquet ultrices, erat tortor sollicitudin mi, sit amet lobortis sapien sapien non mi. Integer ac neque."
Where the Boys Are,Comedy,http://dummyimage.com/240x180.png/cc0000/ffffff,2007,163,0.21,"Cum sociis natoque penatibus et magnis dis parturient montes, nascetur ridiculus mus. Vivamus vestibulum sagittis sapien. Cum sociis natoque penatibus et magnis dis parturient montes, nascetur ridiculus mus."
"Disorderly Orderly, The",Comedy|Romance,http://dummyimage.com/240x180.png/5fa2dd/ffffff,2006,137,0.15,In quis justo. Maecenas rhoncus aliquam lacus. Morbi quis tortor id nulla ultrices aliquet.
"Assassination of Richard Nixon, The",Crime|Drama|Thriller,http://dummyimage.com/240x180.png/dddddd/000000,1988,72,0.7,"Vestibulum ac est lacinia nisi venenatis tristique. Fusce congue, diam id ornare imperdiet, sapien urna pretium nisl, ut volutpat sapien arcu sed augue. Aliquam erat volutpat."
Collapse,Documentary,http://dummyimage.com/240x180.png/5fa2dd/ffffff,2004,177,0.3,Integer tincidunt ante vel ipsum. Praesent blandit lacinia erat. Vestibulum sed magna at nunc commodo placerat.
Never Make It Home,Documentary|Musical,http://dummyimage.com/240x180.png/dddddd/000000,2009,90,0.24,Duis bibendum. Morbi non quam nec dui luctus rutrum. Nulla tellus.
Capturing Mary,(no genres listed),http://dummyimage.com/240x180.png/dddddd/000000,2007,184,0.88,"Cum sociis natoque penatibus et magnis dis parturient montes, nascetur ridiculus mus. Vivamus vestibulum sagittis sapien. Cum sociis natoque penatibus et magnis dis parturient montes, nascetur ridiculus mus."
"Captain Thunder (Capitán Trueno y el Santo Grial, El) (Prince Killian and the Holy Grail)",Adventure,http://dummyimage.com/240x180.png/cc0000/ffffff,2005,159,0.05,Etiam vel augue. Vestibulum rutrum rutrum neque. Aenean auctor gravida sem.
Die Fighting,Action|Thriller,http://dummyimage.com/240x180.png/cc0000/ffffff,2011,189,0.19,"Proin eu mi. Nulla ac enim. In tempor, turpis nec euismod scelerisque, quam turpis adipiscing lorem, vitae mattis nibh ligula nec sem."
"T,O,U,C,H,I,N,G",(no genres listed),http://dummyimage.com/240x180.png/ff4444/ffffff,1999,103,0.18,"Cras mi pede, malesuada in, imperdiet et, commodo vulputate, justo. In blandit ultrices enim. Lorem ipsum dolor sit amet, consectetuer adipiscing elit."
Take Out,Drama,http://dummyimage.com/240x180.png/5fa2dd/ffffff,1995,198,0.68,Nullam sit amet turpis elementum ligula vehicula consequat. Morbi a ipsum. Integer a nibh.
"Monkey's Tale, A (Château des singes, Le)",Animation|Children,http://dummyimage.com/240x180.png/dddddd/000000,2011,90,0.42,"Proin leo odio, porttitor id, consequat in, consequat ut, nulla. Sed accumsan felis. Ut at dolor quis odio consequat varius."
Get Bruce,Documentary,http://dummyimage.com/240x180.png/cc0000/ffffff,2010,120,0.9,"Morbi non lectus. Aliquam sit amet diam in magna bibendum imperdiet. Nullam orci pede, venenatis non, sodales sed, tincidunt eu, felis."
Roadie,Comedy|Drama,http://dummyimage.com/240x180.png/5fa2dd/ffffff,2001,136,0.32,"In sagittis dui vel nisl. Duis ac nibh. Fusce lacus purus, aliquet at, feugiat non, pretium quis, lectus."
Charlie Chan at the Olympics,Comedy|Crime|Mystery|Thriller,http://dummyimage.com/240x180.png/ff4444/ffffff,2009,98,0.46,"Curabitur in libero ut massa volutpat convallis. Morbi odio odio, elementum eu, interdum eu, tincidunt in, leo. Maecenas pulvinar lobortis est."
Battle Royale (Batoru rowaiaru),Action|Drama|Horror|Thriller,http://dummyimage.com/240x180.png/5fa2dd/ffffff,2003,145,0.76,"Curabitur gravida nisi at nibh. In hac habitasse platea dictumst. Aliquam augue quam, sollicitudin vitae, consectetuer eget, rutrum at, lorem."
The Island,Drama|Mystery,http://dummyimage.com/240x180.png/dddddd/000000,1986,147,0.83,"Vestibulum ac est lacinia nisi venenatis tristique. Fusce congue, diam id ornare imperdiet, sapien urna pretium nisl, ut volutpat sapien arcu sed augue. Aliquam erat volutpat."
Enlighten Up!,Documentary,http://dummyimage.com/240x180.png/ff4444/ffffff,1996,165,1.0,Nulla ut erat id mauris vulputate elementum. Nullam varius. Nulla facilisi.
Sunset Park,Drama,http://dummyimage.com/240x180.png/ff4444/ffffff,1992,196,0.87,Suspendisse potenti. In eleifend quam a odio. In hac habitasse platea dictumst.
"Terror's Advocate (Avocat de la terreur, L')",Documentary,http://dummyimage.com/240x180.png/dddddd/000000,2005,93,0.57,Nulla ut erat id mauris vulputate elementum. Nullam varius. Nulla facilisi.
Drive Me Crazy,Comedy|Romance,http://dummyimage.com/240x180.png/ff4444/ffffff,2005,83,0.74,"Quisque porta volutpat erat. Quisque erat eros, viverra eget, congue eget, semper rutrum, nulla. Nunc purus."
Love Me No More (Deux jours à tuer),Drama|Romance,http://dummyimage.com/240x180.png/cc0000/ffffff,1998,151,0.28,"Aenean fermentum. Donec ut mauris eget massa tempor convallis. Nulla neque libero, convallis eget, eleifend luctus, ultricies eu, nibh."
Diggers,Comedy|Drama,http://dummyimage.com/240x180.png/cc0000/ffffff,2011,161,0.25,"In sagittis dui vel nisl. Duis ac nibh. Fusce lacus purus, aliquet at, feugiat non, pretium quis, lectus."
Liberty Heights,Drama,http://dummyimage.com/240x180.png/ff4444/ffffff,1997,101,0.96,"Proin eu mi. Nulla ac enim. In tempor, turpis nec euismod scelerisque, quam turpis adipiscing lorem, vitae mattis nibh ligula nec sem."
"Passion of Ayn Rand, The",Documentary|Drama|Romance,http://dummyimage.com/240x180.png/ff4444/ffffff,2009,132,0.26,Nullam sit amet turpis elementum ligula vehicula consequat. Morbi a ipsum. Integer a nibh.
"Little Night Music, A",Comedy|Musical|Romance,http://dummyimage.com/240x180.png/ff4444/ffffff,1996,162,0.24,Praesent id massa id nisl venenatis lacinia. Aenean sit amet justo. Morbi ut odio.
Chungking Express (Chung Hing sam lam),Drama|Mystery|Romance,http://dummyimage.com/240x180.png/cc0000/ffffff,2006,135,0.31,Pellentesque at nulla. Suspendisse potenti. Cras in purus eu magna vulputate luctus.
Grouse,Comedy,http://dummyimage.com/240x180.png/dddddd/000000,2002,111,0.48,Phasellus sit amet erat. Nulla tempus. Vivamus in felis eu sapien cursus vestibulum.
Remarkable Power,Comedy,http://dummyimage.com/240x180.png/5fa2dd/ffffff,2011,87,0.09,"Proin eu mi. Nulla ac enim. In tempor, turpis nec euismod scelerisque, quam turpis adipiscing lorem, vitae mattis nibh ligula nec sem."
Oki's Movie (Ok-hui-ui yeonghwa),Comedy|Drama,http://dummyimage.com/240x180.png/dddddd/000000,2001,179,0.98,"Maecenas tristique, est et tempus semper, est quam pharetra magna, ac consequat metus sapien ut nunc. Vestibulum ante ipsum primis in faucibus orci luctus et ultrices posuere cubilia Curae; Mauris viverra diam vitae quam. Suspendisse potenti."
Flashback,Action|Comedy,http://dummyimage.com/240x180.png/dddddd/000000,2010,90,0.9,Nulla ut erat id mauris vulputate elementum. Nullam varius. Nulla facilisi.
Author! Author!,Comedy|Drama,http://dummyimage.com/240x180.png/ff4444/ffffff,2005,175,0.04,"Sed sagittis. Nam congue, risus semper porta volutpat, quam pede lobortis ligula, sit amet eleifend pede libero quis orci. Nullam molestie nibh in lectus."
Tropical Malady (Sud pralad),Drama|Fantasy|Romance,http://dummyimage.com/240x180.png/cc0000/ffffff,1995,185,0.58,Nullam sit amet turpis elementum ligula vehicula consequat. Morbi a ipsum. Integer a nibh.
Bloody New Year,Horror|Mystery,http://dummyimage.com/240x180.png/5fa2dd/ffffff,2012,130,0.85,Duis bibendum. Morbi non quam nec dui luctus rutrum. Nulla tellus.
Reasonable Doubt,Crime|Thriller,http://dummyimage.com/240x180.png/5fa2dd/ffffff,2006,176,0.64,In quis justo. Maecenas rhoncus aliquam lacus. Morbi quis tortor id nulla ultrices aliquet.
Ghost Adventures,Documentary,http://dummyimage.com/240x180.png/ff4444/ffffff,2007,114,0.29,Sed ante. Vivamus tortor. Duis mattis egestas metus.
Bloody Murder,Drama|Horror|Thriller,http://dummyimage.com/240x180.png/cc0000/ffffff,1996,132,0.26,Nulla ut erat id mauris vulputate elementum. Nullam varius. Nulla facilisi.
Madison,Drama,http://dummyimage.com/240x180.png/5fa2dd/ffffff,2006,131,0.99,"Curabitur at ipsum ac tellus semper interdum. Mauris ullamcorper purus sit amet nulla. Quisque arcu libero, rutrum ac, lobortis vel, dapibus at, diam."
Zebra Lounge,Thriller,http://dummyimage.com/240x180.png/5fa2dd/ffffff,2011,73,0.42,"Sed sagittis. Nam congue, risus semper porta volutpat, quam pede lobortis ligula, sit amet eleifend pede libero quis orci. Nullam molestie nibh in lectus."
The Whisperer in Darkness,Horror|Mystery|Sci-Fi|Thriller,http://dummyimage.com/240x180.png/cc0000/ffffff,2009,134,0.21,Aliquam quis turpis eget elit sodales scelerisque. Mauris sit amet eros. Suspendisse accumsan tortor quis turpis.
"Edge of Heaven, The (Auf der anderen Seite)",Drama,http://dummyimage.com/240x180.png/ff4444/ffffff,1986,178,0.18,Fusce consequat. Nulla nisl. Nunc nisl.
"10,000 BC",Adventure|Romance|Thriller,http://dummyimage.com/240x180.png/cc0000/ffffff,1997,71,0.69,"Curabitur gravida nisi at nibh. In hac habitasse platea dictumst. Aliquam augue quam, sollicitudin vitae, consectetuer eget, rutrum at, lorem."
Pocketful of Miracles,Comedy|Drama,http://dummyimage.com/240x180.png/dddddd/000000,1995,111,0.65,Aenean lectus. Pellentesque eget nunc. Donec quis orci eget orci vehicula condimentum.
"Sun, The (Solntse)",Drama,http://dummyimage.com/240x180.png/ff4444/ffffff,2001,125,0.7,"Aenean fermentum. Donec ut mauris eget massa tempor convallis. Nulla neque libero, convallis eget, eleifend luctus, ultricies eu, nibh."
Lone Survivor,Action|Drama|Thriller|War,http://dummyimage.com/240x180.png/dddddd/000000,1988,200,0.93,Duis consequat dui nec nisi volutpat eleifend. Donec ut dolor. Morbi vel lectus in quam fringilla rhoncus.
Flight of Fury,Action,http://dummyimage.com/240x180.png/dddddd/000000,2011,121,0.99,Phasellus sit amet erat. Nulla tempus. Vivamus in felis eu sapien cursus vestibulum.
Beyond the Border,Action|Drama|War,http://dummyimage.com/240x180.png/cc0000/ffffff,2011,111,0.85,Integer ac leo. Pellentesque ultrices mattis odio. Donec vitae nisi.
Doughboys,Comedy|War,http://dummyimage.com/240x180.png/ff4444/ffffff,2002,186,0.46,Aliquam quis turpis eget elit sodales scelerisque. Mauris sit amet eros. Suspendisse accumsan tortor quis turpis.
Hack!,Comedy|Horror,http://dummyimage.com/240x180.png/cc0000/ffffff,1990,153,0.64,Phasellus in felis. Donec semper sapien a libero. Nam dui.
Piter FM,Comedy|Drama|Romance,http://dummyimage.com/240x180.png/dddddd/000000,1990,192,0.71,Duis aliquam convallis nunc. Proin at turpis a pede posuere nonummy. Integer non velit.
Where Is the Friend's Home? (Where Is My Friend's House?) (Khane-ye doust kodjast?),Drama,http://dummyimage.com/240x180.png/cc0000/ffffff,2008,118,0.2,"Maecenas tristique, est et tempus semper, est quam pharetra magna, ac consequat metus sapien ut nunc. Vestibulum ante ipsum primis in faucibus orci luctus et ultrices posuere cubilia Curae; Mauris viverra diam vitae quam. Suspendisse potenti."
97 Percent True,Documentary,http://dummyimage.com/240x180.png/ff4444/ffffff,1992,192,0.69,Cras non velit nec nisi vulputate nonummy. Maecenas tincidunt lacus at velit. Vivamus vel nulla eget eros elementum pellentesque.
Kill Switch,Action|Crime|Drama|Thriller,http://dummyimage.com/240x180.png/ff4444/ffffff,2012,164,0.52,Integer tincidunt ante vel ipsum. Praesent blandit lacinia erat. Vestibulum sed magna at nunc commodo placerat.
"Huey P. Newton Story, A",Documentary,http://dummyimage.com/240x180.png/cc0000/ffffff,2006,186,0.29,"Proin leo odio, porttitor id, consequat in, consequat ut, nulla. Sed accumsan felis. Ut at dolor quis odio consequat varius."
Red Obession,Documentary,http://dummyimage.com/240x180.png/ff4444/ffffff,2011,113,0.73,"Vestibulum quam sapien, varius ut, blandit non, interdum in, ante. Vestibulum ante ipsum primis in faucibus orci luctus et ultrices posuere cubilia Curae; Duis faucibus accumsan odio. Curabitur convallis."
Sleepers,Thriller,http://dummyimage.com/240x180.png/ff4444/ffffff,1997,193,0.66,Nullam sit amet turpis elementum ligula vehicula consequat. Morbi a ipsum. Integer a nibh.
"Shoot First, Die Later",Action|Crime,http://dummyimage.com/240x180.png/5fa2dd/ffffff,2003,146,0.73,Fusce consequat. Nulla nisl. Nunc nisl.
Calling Bulldog Drummond,Crime|Mystery,http://dummyimage.com/240x180.png/cc0000/ffffff,1999,85,0.74,"In sagittis dui vel nisl. Duis ac nibh. Fusce lacus purus, aliquet at, feugiat non, pretium quis, lectus."
Cosmonaut (Cosmonauta),Comedy,http://dummyimage.com/240x180.png/5fa2dd/ffffff,1989,184,0.09,Duis aliquam convallis nunc. Proin at turpis a pede posuere nonummy. Integer non velit.
American Ninja,Action|Adventure,http://dummyimage.com/240x180.png/5fa2dd/ffffff,1994,82,0.75,"Quisque porta volutpat erat. Quisque erat eros, viverra eget, congue eget, semper rutrum, nulla. Nunc purus."
Live from Baghdad,Drama|War,http://dummyimage.com/240x180.png/ff4444/ffffff,2008,87,0.42,"Proin interdum mauris non ligula pellentesque ultrices. Phasellus id sapien in sapien iaculis congue. Vivamus metus arcu, adipiscing molestie, hendrerit at, vulputate vitae, nisl."
1984 (Nineteen Eighty-Four),Drama|Sci-Fi,http://dummyimage.com/240x180.png/dddddd/000000,2004,130,0.79,"Curabitur at ipsum ac tellus semper interdum. Mauris ullamcorper purus sit amet nulla. Quisque arcu libero, rutrum ac, lobortis vel, dapibus at, diam."
Invasion of the Body Snatchers,Horror|Mystery|Sci-Fi|Thriller,http://dummyimage.com/240x180.png/ff4444/ffffff,2012,115,0.41,Sed ante. Vivamus tortor. Duis mattis egestas metus.
"Navigator: A Mediaeval Odyssey, The",Adventure|Fantasy|Sci-Fi,http://dummyimage.com/240x180.png/dddddd/000000,1993,139,0.0,"Proin eu mi. Nulla ac enim. In tempor, turpis nec euismod scelerisque, quam turpis adipiscing lorem, vitae mattis nibh ligula nec sem."
"Accidental Spy, The (Dak miu mai shing)",Action|Comedy|Thriller,http://dummyimage.com/240x180.png/cc0000/ffffff,2006,100,0.1,"Curabitur gravida nisi at nibh. In hac habitasse platea dictumst. Aliquam augue quam, sollicitudin vitae, consectetuer eget, rutrum at, lorem."
True Grit,Adventure|Drama|Western,http://dummyimage.com/240x180.png/cc0000/ffffff,1996,192,0.45,Integer ac leo. Pellentesque ultrices mattis odio. Donec vitae nisi.
Getting Away With Murder,Comedy,http://dummyimage.com/240x180.png/5fa2dd/ffffff,2005,185,0.29,Sed ante. Vivamus tortor. Duis mattis egestas metus.
Kariera Nikosia Dyzmy,Comedy,http://dummyimage.com/240x180.png/cc0000/ffffff,1986,104,0.53,"Mauris enim leo, rhoncus sed, vestibulum sit amet, cursus id, turpis. Integer aliquet, massa id lobortis convallis, tortor risus dapibus augue, vel accumsan tellus nisi eu orci. Mauris lacinia sapien quis libero."
Blood and Bone,Action|Drama,http://dummyimage.com/240x180.png/ff4444/ffffff,2008,187,0.78,Phasellus in felis. Donec semper sapien a libero. Nam dui.
"Navigator: A Mediaeval Odyssey, The",Adventure|Fantasy|Sci-Fi,http://dummyimage.com/240x180.png/ff4444/ffffff,1998,102,0.38,"Cras mi pede, malesuada in, imperdiet et, commodo vulputate, justo. In blandit ultrices enim. Lorem ipsum dolor sit amet, consectetuer adipiscing elit."
Sergeant Körmy and the Underwater Vehicles (Vääpeli Körmy ja vetenalaiset vehkeet),Comedy,http://dummyimage.com/240x180.png/cc0000/ffffff,1988,198,0.19,"Quisque id justo sit amet sapien dignissim vestibulum. Vestibulum ante ipsum primis in faucibus orci luctus et ultrices posuere cubilia Curae; Nulla dapibus dolor vel est. Donec odio justo, sollicitudin ut, suscipit a, feugiat et, eros."
Carlos,Crime|Drama|Thriller,http://dummyimage.com/240x180.png/5fa2dd/ffffff,2008,126,0.72,"Mauris enim leo, rhoncus sed, vestibulum sit amet, cursus id, turpis. Integer aliquet, massa id lobortis convallis, tortor risus dapibus augue, vel accumsan tellus nisi eu orci. Mauris lacinia sapien quis libero."
"Iceman, The",Crime|Drama|Thriller,http://dummyimage.com/240x180.png/5fa2dd/ffffff,2012,76,0.78,"Praesent blandit. Nam nulla. Integer pede justo, lacinia eget, tincidunt eget, tempus vel, pede."
Moving the Mountain,Documentary,http://dummyimage.com/240x180.png/ff4444/ffffff,1993,106,0.94,Integer ac leo. Pellentesque ultrices mattis odio. Donec vitae nisi.
Our Vinyl Weighs a Ton: This Is Stones Throw Records,Documentary,http://dummyimage.com/240x180.png/cc0000/ffffff,1984,188,0.57,Nullam porttitor lacus at turpis. Donec posuere metus vitae ipsum. Aliquam non mauris.
Glitterbug,(no genres listed),http://dummyimage.com/240x180.png/ff4444/ffffff,2000,151,0.57,"Vestibulum ac est lacinia nisi venenatis tristique. Fusce congue, diam id ornare imperdiet, sapien urna pretium nisl, ut volutpat sapien arcu sed augue. Aliquam erat volutpat."
Human Failure (Menschliches Versagen),Documentary,http://dummyimage.com/240x180.png/cc0000/ffffff,1992,89,0.37,Maecenas ut massa quis augue luctus tincidunt. Nulla mollis molestie lorem. Quisque ut erat.
Welcome to Australia,Documentary,http://dummyimage.com/240x180.png/dddddd/000000,1998,75,0.89,Sed ante. Vivamus tortor. Duis mattis egestas metus.
Knight Without Armor,Adventure|Drama|Romance|Thriller,http://dummyimage.com/240x180.png/cc0000/ffffff,1996,79,0.53,Duis consequat dui nec nisi volutpat eleifend. Donec ut dolor. Morbi vel lectus in quam fringilla rhoncus.
Personal Effects,Drama,http://dummyimage.com/240x180.png/dddddd/000000,1999,103,0.55,"Proin interdum mauris non ligula pellentesque ultrices. Phasellus id sapien in sapien iaculis congue. Vivamus metus arcu, adipiscing molestie, hendrerit at, vulputate vitae, nisl."
Up the Academy,Comedy,http://dummyimage.com/240x180.png/dddddd/000000,2012,95,0.84,"Proin leo odio, porttitor id, consequat in, consequat ut, nulla. Sed accumsan felis. Ut at dolor quis odio consequat varius."
Vesku from Finland (Vesku),Documentary,http://dummyimage.com/240x180.png/dddddd/000000,2002,123,0.25,Duis consequat dui nec nisi volutpat eleifend. Donec ut dolor. Morbi vel lectus in quam fringilla rhoncus.
Men Without Women,Action|Drama,http://dummyimage.com/240x180.png/ff4444/ffffff,2010,83,0.47,"Morbi porttitor lorem id ligula. Suspendisse ornare consequat lectus. In est risus, auctor sed, tristique in, tempus sit amet, sem."
"Rage in Placid Lake, The",Comedy,http://dummyimage.com/240x180.png/cc0000/ffffff,1992,127,0.94,"Quisque porta volutpat erat. Quisque erat eros, viverra eget, congue eget, semper rutrum, nulla. Nunc purus."
Disclosure,Drama|Thriller,http://dummyimage.com/240x180.png/5fa2dd/ffffff,1998,118,0.0,Phasellus sit amet erat. Nulla tempus. Vivamus in felis eu sapien cursus vestibulum.
Splinter,Action|Horror|Thriller,http://dummyimage.com/240x180.png/5fa2dd/ffffff,2009,99,0.55,"Quisque porta volutpat erat. Quisque erat eros, viverra eget, congue eget, semper rutrum, nulla. Nunc purus."
Naked Ambition: An R Rated Look at an X Rated Industry ,Documentary,http://dummyimage.com/240x180.png/dddddd/000000,2012,101,0.35,"Maecenas leo odio, condimentum id, luctus nec, molestie sed, justo. Pellentesque viverra pede ac diam. Cras pellentesque volutpat dui."
"Bonheur, Le",Drama,http://dummyimage.com/240x180.png/cc0000/ffffff,2012,134,0.77,Aenean lectus. Pellentesque eget nunc. Donec quis orci eget orci vehicula condimentum.
One False Move,Crime|Drama|Film-Noir|Thriller,http://dummyimage.com/240x180.png/dddddd/000000,2006,149,0.34,"Curabitur at ipsum ac tellus semper interdum. Mauris ullamcorper purus sit amet nulla. Quisque arcu libero, rutrum ac, lobortis vel, dapibus at, diam."
I Married A Strange Person!,Animation|Comedy|Fantasy|Sci-Fi,http://dummyimage.com/240x180.png/ff4444/ffffff,2008,196,0.98,Cras non velit nec nisi vulputate nonummy. Maecenas tincidunt lacus at velit. Vivamus vel nulla eget eros elementum pellentesque.
The Message,Crime|Drama|Thriller|War,http://dummyimage.com/240x180.png/ff4444/ffffff,2011,111,0.18,"Sed sagittis. Nam congue, risus semper porta volutpat, quam pede lobortis ligula, sit amet eleifend pede libero quis orci. Nullam molestie nibh in lectus."
Thumbsucker,Comedy|Drama,http://dummyimage.com/240x180.png/dddddd/000000,2007,185,0.85,Integer ac leo. Pellentesque ultrices mattis odio. Donec vitae nisi.
Aftermath: Population Zero,Documentary|Sci-Fi,http://dummyimage.com/240x180.png/ff4444/ffffff,1993,135,0.24,Phasellus in felis. Donec semper sapien a libero. Nam dui.
"Traviata, La",Drama|Musical,http://dummyimage.com/240x180.png/dddddd/000000,1997,74,0.8,Sed ante. Vivamus tortor. Duis mattis egestas metus.
