title,genre,poster,year,duration,score,description
Runaway,Action|Animation|Comedy,http://dummyimage.com/240x180.png/dddddd/000000,2012,183,0.67,"Sed sagittis. Nam congue, risus semper porta volutpat, quam pede lobortis ligula, sit amet eleifend pede libero quis orci. Nullam molestie nibh in lectus."
"Spitfire Grill, The",Drama,http://dummyimage.com/240x180.png/ff4444/ffffff,2009,137,0.96,"Curabitur at ipsum ac tellus semper interdum. Mauris ullamcorper purus sit amet nulla. Quisque arcu libero, rutrum ac, lobortis vel, dapibus at, diam."
"Woman Who Drinks, The (La femme qui boit)",Drama|Romance,http://dummyimage.com/240x180.png/dddddd/000000,2000,86,0.5,"Donec diam neque, vestibulum eget, vulputate ut, ultrices vel, augue. Vestibulum ante ipsum primis in faucibus orci luctus et ultrices posuere cubilia Curae; Donec pharetra, magna vestibulum aliquet ultrices, erat tortor sollicitudin mi, sit amet lobortis sapien sapien non mi. Integer ac neque."
Detroit Rock City,Comedy,http://dummyimage.com/240x180.png/5fa2dd/ffffff,1999,134,0.82,"Maecenas leo odio, condimentum id, luctus nec, molestie sed, justo. Pellentesque viverra pede ac diam. Cras pellentesque volutpat dui."
Tangled Ever After,Action|Animation|Children,http://dummyimage.com/240x180.png/5fa2dd/ffffff,1995,95,0.93,Aliquam quis turpis eget elit sodales scelerisque. Mauris sit amet eros. Suspendisse accumsan tortor quis turpis.
Calle 54,Documentary|Musical,http://dummyimage.com/240x180.png/cc0000/ffffff,2007,192,0.18,"Curabitur gravida nisi at nibh. In hac habitasse platea dictumst. Aliquam augue quam, sollicitudin vitae, consectetuer eget, rutrum at, lorem."
The Message,Crime|Drama|Thriller|War,http://dummyimage.com/240x180.png/dddddd/000000,1987,112,0.95,Integer tincidunt ante vel ipsum. Praesent blandit lacinia erat. Vestibulum sed magna at nunc commodo placerat.
"Gypsy Moths, The",Drama,http://dummyimage.com/240x180.png/dddddd/000000,1995,146,0.59,In hac habitasse platea dictumst. Etiam faucibus cursus urna. Ut tellus.
Broken Kingdom,Drama,http://dummyimage.com/240x180.png/ff4444/ffffff,2007,192,0.33,"Donec diam neque, vestibulum eget, vulputate ut, ultrices vel, augue. Vestibulum ante ipsum primis in faucibus orci luctus et ultrices posuere cubilia Curae; Donec pharetra, magna vestibulum aliquet ultrices, erat tortor sollicitudin mi, sit amet lobortis sapien sapien non mi. Integer ac neque."
"Burrowers, The",Horror|Thriller|Western,http://dummyimage.com/240x180.png/5fa2dd/ffffff,2007,72,0.28,"In sagittis dui vel nisl. Duis ac nibh. Fusce lacus purus, aliquet at, feugiat non, pretium quis, lectus."
Kamchatka,Drama,http://dummyimage.com/240x180.png/cc0000/ffffff,2006,175,0.39,Praesent id massa id nisl venenatis lacinia. Aenean sit amet justo. Morbi ut odio.
So Big!,Drama,http://dummyimage.com/240x180.png/dddddd/000000,2006,110,0.45,"Proin interdum mauris non ligula pellentesque ultrices. Phasellus id sapien in sapien iaculis congue. Vivamus metus arcu, adipiscing molestie, hendrerit at, vulputate vitae, nisl."
JFK: The Smoking Gun,Documentary,http://dummyimage.com/240x180.png/5fa2dd/ffffff,1996,106,0.06,"Proin interdum mauris non ligula pellentesque ultrices. Phasellus id sapien in sapien iaculis congue. Vivamus metus arcu, adipiscing molestie, hendrerit at, vulputate vitae, nisl."
Love Exposure,Action|Comedy|Drama|Romance,http://dummyimage.com/240x180.png/ff4444/ffffff,1995,102,0.19,"Quisque porta volutpat erat. Quisque erat eros, viverra eget, congue eget, semper rutrum, nulla. Nunc purus."
21 Grams,Crime|Drama|Mystery|Romance|Thriller,http://dummyimage.com/240x180.png/dddddd/000000,1994,142,0.36,"Duis bibendum, felis sed interdum venenatis, turpis enim blandit mi, in porttitor pede justo eu massa. Donec dapibus. Duis at velit eu est congue elementum."
Burnt by the Sun (Utomlyonnye solntsem),Drama,http://dummyimage.com/240x180.png/dddddd/000000,2012,186,0.26,Nulla ut erat id mauris vulputate elementum. Nullam varius. Nulla facilisi.
"Limey, The",Crime|Drama|Thriller,http://dummyimage.com/240x180.png/dddddd/000000,2010,96,0.63,"Maecenas leo odio, condimentum id, luctus nec, molestie sed, justo. Pellentesque viverra pede ac diam. Cras pellentesque volutpat dui."
Sheep Eaters (Lampaansyöjät),Comedy|Drama,http://dummyimage.com/240x180.png/ff4444/ffffff,2006,183,0.65,Integer ac leo. Pellentesque ultrices mattis odio. Donec vitae nisi.
Agony (a.k.a. Rasputin) (Agoniya),Drama,http://dummyimage.com/240x180.png/dddddd/000000,2003,118,0.64,"Mauris enim leo, rhoncus sed, vestibulum sit amet, cursus id, turpis. Integer aliquet, massa id lobortis convallis, tortor risus dapibus augue, vel accumsan tellus nisi eu orci. Mauris lacinia sapien quis libero."
"Black Hole, The",Children|Sci-Fi,http://dummyimage.com/240x180.png/dddddd/000000,2002,153,0.77,Suspendisse potenti. In eleifend quam a odio. In hac habitasse platea dictumst.
Cold Showers (Douches froides),Drama,http://dummyimage.com/240x180.png/cc0000/ffffff,2009,183,0.15,Duis bibendum. Morbi non quam nec dui luctus rutrum. Nulla tellus.
Twogether,Comedy|Drama,http://dummyimage.com/240x180.png/dddddd/000000,2011,74,0.44,"Curabitur in libero ut massa volutpat convallis. Morbi odio odio, elementum eu, interdum eu, tincidunt in, leo. Maecenas pulvinar lobortis est."
Little Girl (La pivellina),Drama,http://dummyimage.com/240x180.png/dddddd/000000,1993,109,0.2,Sed ante. Vivamus tortor. Duis mattis egestas metus.
Whisky Galore,Comedy|Crime,http://dummyimage.com/240x180.png/dddddd/000000,1990,132,0.01,"In sagittis dui vel nisl. Duis ac nibh. Fusce lacus purus, aliquet at, feugiat non, pretium quis, lectus."
"Disorderly Orderly, The",Comedy|Romance,http://dummyimage.com/240x180.png/ff4444/ffffff,2010,199,0.71,Nulla ut erat id mauris vulputate elementum. Nullam varius. Nulla facilisi.
Eu Não Quero Voltar Sozinho (I Don't Want to Go Back Alone),Drama|Romance,http://dummyimage.com/240x180.png/5fa2dd/ffffff,2010,183,0.8,Duis consequat dui nec nisi volutpat eleifend. Donec ut dolor. Morbi vel lectus in quam fringilla rhoncus.
Samoure,Drama,http://dummyimage.com/240x180.png/cc0000/ffffff,1961,161,0.37,"Sed sagittis. Nam congue, risus semper porta volutpat, quam pede lobortis ligula, sit amet eleifend pede libero quis orci. Nullam molestie nibh in lectus."
"Dungeon Masters, The",Documentary,http://dummyimage.com/240x180.png/cc0000/ffffff,2006,92,0.88,Etiam vel augue. Vestibulum rutrum rutrum neque. Aenean auctor gravida sem.
Bratz: The Movie,Comedy,http://dummyimage.com/240x180.png/cc0000/ffffff,2011,77,0.3,Integer tincidunt ante vel ipsum. Praesent blandit lacinia erat. Vestibulum sed magna at nunc commodo placerat.
Ransom,Crime|Thriller,http://dummyimage.com/240x180.png/ff4444/ffffff,1969,102,0.75,Maecenas ut massa quis augue luctus tincidunt. Nulla mollis molestie lorem. Quisque ut erat.
Venice/Venice,Drama,http://dummyimage.com/240x180.png/ff4444/ffffff,1992,168,0.75,"Quisque id justo sit amet sapien dignissim vestibulum. Vestibulum ante ipsum primis in faucibus orci luctus et ultrices posuere cubilia Curae; Nulla dapibus dolor vel est. Donec odio justo, sollicitudin ut, suscipit a, feugiat et, eros."
Document of the Dead,Documentary|Horror,http://dummyimage.com/240x180.png/5fa2dd/ffffff,1997,131,0.3,"Nam ultrices, libero non mattis pulvinar, nulla pede ullamcorper augue, a suscipit nulla elit ac nulla. Sed vel enim sit amet nunc viverra dapibus. Nulla suscipit ligula in lacus."
"Dude, Where's My Car?",Comedy|Sci-Fi,http://dummyimage.com/240x180.png/dddddd/000000,2006,147,0.93,"Morbi non lectus. Aliquam sit amet diam in magna bibendum imperdiet. Nullam orci pede, venenatis non, sodales sed, tincidunt eu, felis."
"Prisoner of Zenda, The",Action|Adventure|Romance,http://dummyimage.com/240x180.png/ff4444/ffffff,2001,133,0.97,"Quisque porta volutpat erat. Quisque erat eros, viverra eget, congue eget, semper rutrum, nulla. Nunc purus."
Frequencies,Mystery|Romance|Sci-Fi,http://dummyimage.com/240x180.png/dddddd/000000,2007,198,0.54,Nullam porttitor lacus at turpis. Donec posuere metus vitae ipsum. Aliquam non mauris.
Saps at Sea,Comedy,http://dummyimage.com/240x180.png/dddddd/000000,1998,82,0.4,"In hac habitasse platea dictumst. Morbi vestibulum, velit id pretium iaculis, diam erat fermentum justo, nec condimentum neque sapien placerat ante. Nulla justo."
Resident Evil,Action|Horror|Sci-Fi|Thriller,http://dummyimage.com/240x180.png/ff4444/ffffff,1990,80,0.07,Duis aliquam convallis nunc. Proin at turpis a pede posuere nonummy. Integer non velit.
"Great Yokai War, The (Yôkai daisensô)",Adventure|Comedy|Fantasy|Horror,http://dummyimage.com/240x180.png/5fa2dd/ffffff,1992,139,0.38,"In hac habitasse platea dictumst. Morbi vestibulum, velit id pretium iaculis, diam erat fermentum justo, nec condimentum neque sapien placerat ante. Nulla justo."
"Forsyte Saga, The",Drama,http://dummyimage.com/240x180.png/cc0000/ffffff,1995,136,0.98,"Morbi non lectus. Aliquam sit amet diam in magna bibendum imperdiet. Nullam orci pede, venenatis non, sodales sed, tincidunt eu, felis."
Unexpected,Comedy|Drama,http://dummyimage.com/240x180.png/dddddd/000000,2000,124,0.72,Nullam porttitor lacus at turpis. Donec posuere metus vitae ipsum. Aliquam non mauris.
"Round-Up, The (Szegénylegények)",Drama|War,http://dummyimage.com/240x180.png/5fa2dd/ffffff,1995,160,0.98,"Praesent blandit. Nam nulla. Integer pede justo, lacinia eget, tincidunt eget, tempus vel, pede."
"Great McGinty, The",Comedy,http://dummyimage.com/240x180.png/cc0000/ffffff,1988,101,0.0,Etiam vel augue. Vestibulum rutrum rutrum neque. Aenean auctor gravida sem.
Men Cry Bullets,Comedy|Drama,http://dummyimage.com/240x180.png/dddddd/000000,2000,71,0.43,Phasellus in felis. Donec semper sapien a libero. Nam dui.
More Wild Wild West,Adventure|Comedy|Sci-Fi|Western,http://dummyimage.com/240x180.png/dddddd/000000,1997,135,0.99,"Curabitur gravida nisi at nibh. In hac habitasse platea dictumst. Aliquam augue quam, sollicitudin vitae, consectetuer eget, rutrum at, lorem."
Broadway Melody of 1936,Musical|Romance,http://dummyimage.com/240x180.png/cc0000/ffffff,2008,71,0.17,"Proin leo odio, porttitor id, consequat in, consequat ut, nulla. Sed accumsan felis. Ut at dolor quis odio consequat varius."
Waiting to Exhale,Comedy|Drama|Romance,http://dummyimage.com/240x180.png/cc0000/ffffff,1989,193,0.53,"Maecenas leo odio, condimentum id, luctus nec, molestie sed, justo. Pellentesque viverra pede ac diam. Cras pellentesque volutpat dui."
Above Suspicion,Drama|Thriller,http://dummyimage.com/240x180.png/5fa2dd/ffffff,2012,91,0.93,"Quisque porta volutpat erat. Quisque erat eros, viverra eget, congue eget, semper rutrum, nulla. Nunc purus."
The Beast of the City,Crime|Drama|Film-Noir|Romance,http://dummyimage.com/240x180.png/5fa2dd/ffffff,1989,194,0.0,Suspendisse potenti. In eleifend quam a odio. In hac habitasse platea dictumst.
Kill List,Horror|Mystery|Thriller,http://dummyimage.com/240x180.png/dddddd/000000,1987,155,0.48,In congue. Etiam justo. Etiam pretium iaculis justo.
Girls Just Want to Have Fun,Comedy,http://dummyimage.com/240x180.png/cc0000/ffffff,2010,161,0.3,"Donec diam neque, vestibulum eget, vulputate ut, ultrices vel, augue. Vestibulum ante ipsum primis in faucibus orci luctus et ultrices posuere cubilia Curae; Donec pharetra, magna vestibulum aliquet ultrices, erat tortor sollicitudin mi, sit amet lobortis sapien sapien non mi. Integer ac neque."
Private Parts,Horror|Thriller,http://dummyimage.com/240x180.png/5fa2dd/ffffff,2006,144,0.88,"Mauris enim leo, rhoncus sed, vestibulum sit amet, cursus id, turpis. Integer aliquet, massa id lobortis convallis, tortor risus dapibus augue, vel accumsan tellus nisi eu orci. Mauris lacinia sapien quis libero."
Seeking Justice,Action|Drama|Thriller,http://dummyimage.com/240x180.png/5fa2dd/ffffff,1992,110,0.56,"Sed sagittis. Nam congue, risus semper porta volutpat, quam pede lobortis ligula, sit amet eleifend pede libero quis orci. Nullam molestie nibh in lectus."
Breathless,Thriller,http://dummyimage.com/240x180.png/dddddd/000000,2007,113,0.92,Praesent id massa id nisl venenatis lacinia. Aenean sit amet justo. Morbi ut odio.
Not Your Typical Bigfoot Movie,Documentary,http://dummyimage.com/240x180.png/ff4444/ffffff,2011,179,0.85,"Cras mi pede, malesuada in, imperdiet et, commodo vulputate, justo. In blandit ultrices enim. Lorem ipsum dolor sit amet, consectetuer adipiscing elit."
Who Am I? (Wo shi shei),Action|Adventure|Comedy|Sci-Fi|Thriller,http://dummyimage.com/240x180.png/dddddd/000000,1999,189,0.5,Integer tincidunt ante vel ipsum. Praesent blandit lacinia erat. Vestibulum sed magna at nunc commodo placerat.
Kiss of Death,Crime|Drama|Film-Noir,http://dummyimage.com/240x180.png/ff4444/ffffff,2001,101,0.31,Aenean lectus. Pellentesque eget nunc. Donec quis orci eget orci vehicula condimentum.
Divorce,Drama,http://dummyimage.com/240x180.png/5fa2dd/ffffff,1993,97,0.62,"In sagittis dui vel nisl. Duis ac nibh. Fusce lacus purus, aliquet at, feugiat non, pretium quis, lectus."
The Final Girl,Drama,http://dummyimage.com/240x180.png/cc0000/ffffff,2010,158,0.0,"Maecenas leo odio, condimentum id, luctus nec, molestie sed, justo. Pellentesque viverra pede ac diam. Cras pellentesque volutpat dui."
Quality Street,Comedy|Drama|Romance,http://dummyimage.com/240x180.png/5fa2dd/ffffff,2007,115,0.75,"Cum sociis natoque penatibus et magnis dis parturient montes, nascetur ridiculus mus. Vivamus vestibulum sagittis sapien. Cum sociis natoque penatibus et magnis dis parturient montes, nascetur ridiculus mus."
"Adventures of Ford Fairlane, The",Action|Comedy,http://dummyimage.com/240x180.png/dddddd/000000,2004,88,0.12,Nullam sit amet turpis elementum ligula vehicula consequat. Morbi a ipsum. Integer a nibh.
Cowards Bend the Knee (a.k.a. The Blue Hands),Drama|Romance,http://dummyimage.com/240x180.png/5fa2dd/ffffff,1993,125,0.19,In hac habitasse platea dictumst. Etiam faucibus cursus urna. Ut tellus.
Wavelength,Drama,http://dummyimage.com/240x180.png/dddddd/000000,2002,181,0.32,"Praesent blandit. Nam nulla. Integer pede justo, lacinia eget, tincidunt eget, tempus vel, pede."
White Night (Hvid nat),Drama,http://dummyimage.com/240x180.png/dddddd/000000,2010,135,0.38,In quis justo. Maecenas rhoncus aliquam lacus. Morbi quis tortor id nulla ultrices aliquet.
Windstruck (Nae yeojachingureul sogae habnida),Comedy|Crime|Drama,http://dummyimage.com/240x180.png/cc0000/ffffff,1995,159,0.6,Aenean lectus. Pellentesque eget nunc. Donec quis orci eget orci vehicula condimentum.
Blind Shaft (Mang jing),Drama,http://dummyimage.com/240x180.png/ff4444/ffffff,2010,116,0.06,Fusce consequat. Nulla nisl. Nunc nisl.
To the Limit (Am Limit),Documentary,http://dummyimage.com/240x180.png/dddddd/000000,2009,137,0.15,"Morbi porttitor lorem id ligula. Suspendisse ornare consequat lectus. In est risus, auctor sed, tristique in, tempus sit amet, sem."
"Pandora's Box (Büchse der Pandora, Die)",Drama,http://dummyimage.com/240x180.png/dddddd/000000,1994,76,0.63,"Proin leo odio, porttitor id, consequat in, consequat ut, nulla. Sed accumsan felis. Ut at dolor quis odio consequat varius."
"Man with No Shadow, The (Homme sans ombre, L')",Animation|Drama,http://dummyimage.com/240x180.png/cc0000/ffffff,1996,116,0.02,"Donec diam neque, vestibulum eget, vulputate ut, ultrices vel, augue. Vestibulum ante ipsum primis in faucibus orci luctus et ultrices posuere cubilia Curae; Donec pharetra, magna vestibulum aliquet ultrices, erat tortor sollicitudin mi, sit amet lobortis sapien sapien non mi. Integer ac neque."
"Defender, The",Action,http://dummyimage.com/240x180.png/5fa2dd/ffffff,2008,184,0.63,In quis justo. Maecenas rhoncus aliquam lacus. Morbi quis tortor id nulla ultrices aliquet.
Paziraie Sadeh,Drama,http://dummyimage.com/240x180.png/dddddd/000000,2001,185,0.81,"Sed sagittis. Nam congue, risus semper porta volutpat, quam pede lobortis ligula, sit amet eleifend pede libero quis orci. Nullam molestie nibh in lectus."
"Last Rites of Joe May, The",Drama,http://dummyimage.com/240x180.png/dddddd/000000,2005,107,0.19,"Fusce posuere felis sed lacus. Morbi sem mauris, laoreet ut, rhoncus aliquet, pulvinar sed, nisl. Nunc rhoncus dui vel sem."
"Ron Clark Story, The",Drama,http://dummyimage.com/240x180.png/dddddd/000000,2009,119,0.66,Sed ante. Vivamus tortor. Duis mattis egestas metus.
Dogs,Horror|Thriller,http://dummyimage.com/240x180.png/dddddd/000000,1987,200,0.84,Duis aliquam convallis nunc. Proin at turpis a pede posuere nonummy. Integer non velit.
The Scapegoat,Drama,http://dummyimage.com/240x180.png/dddddd/000000,1979,86,0.38,"Nam ultrices, libero non mattis pulvinar, nulla pede ullamcorper augue, a suscipit nulla elit ac nulla. Sed vel enim sit amet nunc viverra dapibus. Nulla suscipit ligula in lacus."
Random Hearts,Drama|Romance,http://dummyimage.com/240x180.png/cc0000/ffffff,1995,169,0.84,"Lorem ipsum dolor sit amet, consectetuer adipiscing elit. Proin risus. Praesent lectus."
With Love... from the Age of Reason,Comedy|Romance,http://dummyimage.com/240x180.png/dddddd/000000,2001,93,0.43,"Maecenas tristique, est et tempus semper, est quam pharetra magna, ac consequat metus sapien ut nunc. Vestibulum ante ipsum primis in faucibus orci luctus et ultrices posuere cubilia Curae; Mauris viverra diam vitae quam. Suspendisse potenti."
Kung Fu Hustle (Gong fu),Action|Comedy,http://dummyimage.com/240x180.png/5fa2dd/ffffff,2012,107,0.57,Duis consequat dui nec nisi volutpat eleifend. Donec ut dolor. Morbi vel lectus in quam fringilla rhoncus.
Saving Shiloh,Children|Drama,http://dummyimage.com/240x180.png/cc0000/ffffff,2010,166,0.25,"Praesent blandit. Nam nulla. Integer pede justo, lacinia eget, tincidunt eget, tempus vel, pede."
Batman & Robin,Action|Adventure|Fantasy|Thriller,http://dummyimage.com/240x180.png/dddddd/000000,2009,88,0.99,"Sed sagittis. Nam congue, risus semper porta volutpat, quam pede lobortis ligula, sit amet eleifend pede libero quis orci. Nullam molestie nibh in lectus."
Captain Blood,Action|Adventure|Romance,http://dummyimage.com/240x180.png/5fa2dd/ffffff,2001,88,0.52,Suspendisse potenti. In eleifend quam a odio. In hac habitasse platea dictumst.
Carmina or Blow Up (Carmina o revienta),Comedy|Drama,http://dummyimage.com/240x180.png/cc0000/ffffff,1992,160,0.48,"Maecenas leo odio, condimentum id, luctus nec, molestie sed, justo. Pellentesque viverra pede ac diam. Cras pellentesque volutpat dui."
976-EVIL,Horror,http://dummyimage.com/240x180.png/cc0000/ffffff,1999,123,0.15,"Quisque id justo sit amet sapien dignissim vestibulum. Vestibulum ante ipsum primis in faucibus orci luctus et ultrices posuere cubilia Curae; Nulla dapibus dolor vel est. Donec odio justo, sollicitudin ut, suscipit a, feugiat et, eros."
Underworld: Rise of the Lycans,Action|Fantasy|Horror|Thriller,http://dummyimage.com/240x180.png/ff4444/ffffff,1993,176,0.78,"Donec diam neque, vestibulum eget, vulputate ut, ultrices vel, augue. Vestibulum ante ipsum primis in faucibus orci luctus et ultrices posuere cubilia Curae; Donec pharetra, magna vestibulum aliquet ultrices, erat tortor sollicitudin mi, sit amet lobortis sapien sapien non mi. Integer ac neque."
Star Trek III: The Search for Spock,Action|Adventure|Sci-Fi,http://dummyimage.com/240x180.png/5fa2dd/ffffff,2010,138,0.35,"Proin leo odio, porttitor id, consequat in, consequat ut, nulla. Sed accumsan felis. Ut at dolor quis odio consequat varius."
French Twist (Gazon maudit),Comedy|Romance,http://dummyimage.com/240x180.png/ff4444/ffffff,2001,127,0.41,Nullam sit amet turpis elementum ligula vehicula consequat. Morbi a ipsum. Integer a nibh.
Il Mare (Siworae),Fantasy|Romance|Sci-Fi,http://dummyimage.com/240x180.png/ff4444/ffffff,1984,159,0.84,In congue. Etiam justo. Etiam pretium iaculis justo.
Diamond Dogs,Action|Adventure,http://dummyimage.com/240x180.png/ff4444/ffffff,1984,186,0.27,Aliquam quis turpis eget elit sodales scelerisque. Mauris sit amet eros. Suspendisse accumsan tortor quis turpis.
Brink of Life (Nära livet),Drama,http://dummyimage.com/240x180.png/dddddd/000000,2012,142,0.7,Maecenas ut massa quis augue luctus tincidunt. Nulla mollis molestie lorem. Quisque ut erat.
Endangered Species,Mystery|Sci-Fi|Thriller,http://dummyimage.com/240x180.png/ff4444/ffffff,2000,111,0.85,In congue. Etiam justo. Etiam pretium iaculis justo.
"Tomorrow, the World!",Drama,http://dummyimage.com/240x180.png/cc0000/ffffff,2010,155,0.42,In congue. Etiam justo. Etiam pretium iaculis justo.
Charlie Chan at the Olympics,Comedy|Crime|Mystery|Thriller,http://dummyimage.com/240x180.png/cc0000/ffffff,2007,198,0.97,Sed ante. Vivamus tortor. Duis mattis egestas metus.
Don't Say a Word,Thriller,http://dummyimage.com/240x180.png/cc0000/ffffff,1999,156,0.1,"Curabitur gravida nisi at nibh. In hac habitasse platea dictumst. Aliquam augue quam, sollicitudin vitae, consectetuer eget, rutrum at, lorem."
Act Da Fool,(no genres listed),http://dummyimage.com/240x180.png/5fa2dd/ffffff,1996,140,0.68,"Maecenas leo odio, condimentum id, luctus nec, molestie sed, justo. Pellentesque viverra pede ac diam. Cras pellentesque volutpat dui."
Lotte Reiniger: Homage to the Inventor of the Silhouette Film,Documentary,http://dummyimage.com/240x180.png/cc0000/ffffff,2010,127,0.5,Aliquam quis turpis eget elit sodales scelerisque. Mauris sit amet eros. Suspendisse accumsan tortor quis turpis.
"Wolfman, The",Horror|Thriller,http://dummyimage.com/240x180.png/dddddd/000000,1994,98,0.12,In quis justo. Maecenas rhoncus aliquam lacus. Morbi quis tortor id nulla ultrices aliquet.
Starred Up,Drama,http://dummyimage.com/240x180.png/5fa2dd/ffffff,1997,171,0.37,"Proin eu mi. Nulla ac enim. In tempor, turpis nec euismod scelerisque, quam turpis adipiscing lorem, vitae mattis nibh ligula nec sem."
El asombroso mundo de Borjamari y Pocholo,(no genres listed),http://dummyimage.com/240x180.png/dddddd/000000,2000,162,0.83,Fusce consequat. Nulla nisl. Nunc nisl.
My Left Eye Sees Ghosts (Ngo joh aan gin diy gwai),Comedy|Fantasy|Romance,http://dummyimage.com/240x180.png/ff4444/ffffff,2007,185,0.55,Nullam sit amet turpis elementum ligula vehicula consequat. Morbi a ipsum. Integer a nibh.
"Promised Life, The (Vie promise, La)",Drama,http://dummyimage.com/240x180.png/dddddd/000000,2011,181,0.9,Duis aliquam convallis nunc. Proin at turpis a pede posuere nonummy. Integer non velit.
Sin Nombre,Crime|Drama|Thriller,http://dummyimage.com/240x180.png/cc0000/ffffff,2005,135,0.21,Fusce consequat. Nulla nisl. Nunc nisl.
"Jonathan Rosenbaum, Present",Documentary,http://dummyimage.com/240x180.png/5fa2dd/ffffff,1989,189,0.64,Phasellus sit amet erat. Nulla tempus. Vivamus in felis eu sapien cursus vestibulum.
National Theatre Live: Frankenstein,Drama|Fantasy,http://dummyimage.com/240x180.png/5fa2dd/ffffff,1993,145,0.17,"Mauris enim leo, rhoncus sed, vestibulum sit amet, cursus id, turpis. Integer aliquet, massa id lobortis convallis, tortor risus dapibus augue, vel accumsan tellus nisi eu orci. Mauris lacinia sapien quis libero."
Blondie on a Budget,Comedy,http://dummyimage.com/240x180.png/ff4444/ffffff,1993,134,0.87,Duis aliquam convallis nunc. Proin at turpis a pede posuere nonummy. Integer non velit.
Young & Wild (Joven y alocada),Drama,http://dummyimage.com/240x180.png/dddddd/000000,2012,73,0.16,Nullam porttitor lacus at turpis. Donec posuere metus vitae ipsum. Aliquam non mauris.
Harmagedon,Action|Drama,http://dummyimage.com/240x180.png/cc0000/ffffff,2004,160,0.92,"Sed sagittis. Nam congue, risus semper porta volutpat, quam pede lobortis ligula, sit amet eleifend pede libero quis orci. Nullam molestie nibh in lectus."
Perfume: The Story of a Murderer,Crime|Drama|Thriller,http://dummyimage.com/240x180.png/ff4444/ffffff,1990,126,0.66,"Morbi porttitor lorem id ligula. Suspendisse ornare consequat lectus. In est risus, auctor sed, tristique in, tempus sit amet, sem."
Great Freedom No. 7 (Port of Freedom) (Große Freiheit Nr. 7),Drama|Musical|Romance,http://dummyimage.com/240x180.png/ff4444/ffffff,2001,91,0.36,Nulla ut erat id mauris vulputate elementum. Nullam varius. Nulla facilisi.
My Lucky Stars (Fuk sing go jiu),Action|Comedy,http://dummyimage.com/240x180.png/5fa2dd/ffffff,2006,194,0.16,Fusce consequat. Nulla nisl. Nunc nisl.
"Strategy of the Snail, The (Estrategia del Caracol, La)",Comedy|Drama,http://dummyimage.com/240x180.png/cc0000/ffffff,2006,76,0.08,"Nam ultrices, libero non mattis pulvinar, nulla pede ullamcorper augue, a suscipit nulla elit ac nulla. Sed vel enim sit amet nunc viverra dapibus. Nulla suscipit ligula in lacus."
Puss in Boots: The Three Diablos,Animation|Comedy,http://dummyimage.com/240x180.png/dddddd/000000,1994,112,0.3,Fusce consequat. Nulla nisl. Nunc nisl.
Monkey Business,Comedy,http://dummyimage.com/240x180.png/cc0000/ffffff,2004,92,0.58,"Sed sagittis. Nam congue, risus semper porta volutpat, quam pede lobortis ligula, sit amet eleifend pede libero quis orci. Nullam molestie nibh in lectus."
"Devil's Carnival, The",Horror|Musical,http://dummyimage.com/240x180.png/5fa2dd/ffffff,2007,115,0.5,"Proin eu mi. Nulla ac enim. In tempor, turpis nec euismod scelerisque, quam turpis adipiscing lorem, vitae mattis nibh ligula nec sem."
"Matrix, The",Action|Sci-Fi|Thriller,http://dummyimage.com/240x180.png/dddddd/000000,1998,197,0.09,"Aenean fermentum. Donec ut mauris eget massa tempor convallis. Nulla neque libero, convallis eget, eleifend luctus, ultricies eu, nibh."
Bastard Out of Carolina,Drama,http://dummyimage.com/240x180.png/cc0000/ffffff,2005,139,0.29,"Cras mi pede, malesuada in, imperdiet et, commodo vulputate, justo. In blandit ultrices enim. Lorem ipsum dolor sit amet, consectetuer adipiscing elit."
"Bulli: Cooking in Progress, El",Documentary,http://dummyimage.com/240x180.png/ff4444/ffffff,2002,148,0.99,"Curabitur in libero ut massa volutpat convallis. Morbi odio odio, elementum eu, interdum eu, tincidunt in, leo. Maecenas pulvinar lobortis est."
"Marine, The",Action|Drama|Thriller,http://dummyimage.com/240x180.png/ff4444/ffffff,1992,157,0.09,Sed ante. Vivamus tortor. Duis mattis egestas metus.
