title,genre,poster,year,duration,score,description
"Jungle Creature: Hugo, The (Jungledyret) (Go Hugo Go)",Animation|Children|Musical|Romance,http://dummyimage.com/240x180.png/ff4444/ffffff,2006,90,0.56,"Sed sagittis. Nam congue, risus semper porta volutpat, quam pede lobortis ligula, sit amet eleifend pede libero quis orci. Nullam molestie nibh in lectus."
"Welcome Home, Roscoe Jenkins",Comedy,http://dummyimage.com/240x180.png/dddddd/000000,1987,196,0.28,Sed ante. Vivamus tortor. Duis mattis egestas metus.
"Changeling, The",Horror|Mystery|Thriller,http://dummyimage.com/240x180.png/ff4444/ffffff,2002,106,0.57,Suspendisse potenti. In eleifend quam a odio. In hac habitasse platea dictumst.
To Live (Huozhe),Drama,http://dummyimage.com/240x180.png/ff4444/ffffff,2002,182,0.29,Nullam sit amet turpis elementum ligula vehicula consequat. Morbi a ipsum. Integer a nibh.
Preaching to the Perverted,Comedy|Drama,http://dummyimage.com/240x180.png/ff4444/ffffff,2002,173,0.95,"Curabitur gravida nisi at nibh. In hac habitasse platea dictumst. Aliquam augue quam, sollicitudin vitae, consectetuer eget, rutrum at, lorem."
Reindeerspotting - Pako joulumaasta,Documentary,http://dummyimage.com/240x180.png/ff4444/ffffff,1994,100,0.81,Integer tincidunt ante vel ipsum. Praesent blandit lacinia erat. Vestibulum sed magna at nunc commodo placerat.
"Art of Negative Thinking, The (Kunsten å tenke negativt)",Comedy|Drama,http://dummyimage.com/240x180.png/5fa2dd/ffffff,2010,90,0.83,Sed ante. Vivamus tortor. Duis mattis egestas metus.
Roula,Drama,http://dummyimage.com/240x180.png/cc0000/ffffff,2012,198,0.58,"Curabitur gravida nisi at nibh. In hac habitasse platea dictumst. Aliquam augue quam, sollicitudin vitae, consectetuer eget, rutrum at, lorem."
Poltergeist III,Horror|Thriller,http://dummyimage.com/240x180.png/cc0000/ffffff,1999,163,0.44,Suspendisse potenti. In eleifend quam a odio. In hac habitasse platea dictumst.
In a Year with 13 Moons (In einem Jahr mit 13 Monden),Drama,http://dummyimage.com/240x180.png/5fa2dd/ffffff,2008,191,0.36,"Proin eu mi. Nulla ac enim. In tempor, turpis nec euismod scelerisque, quam turpis adipiscing lorem, vitae mattis nibh ligula nec sem."
Soul Men,Comedy|Musical,http://dummyimage.com/240x180.png/cc0000/ffffff,1996,122,0.23,Aliquam quis turpis eget elit sodales scelerisque. Mauris sit amet eros. Suspendisse accumsan tortor quis turpis.
Zero Dark Thirty,Action|Drama|Thriller,http://dummyimage.com/240x180.png/dddddd/000000,2004,71,0.66,"Curabitur at ipsum ac tellus semper interdum. Mauris ullamcorper purus sit amet nulla. Quisque arcu libero, rutrum ac, lobortis vel, dapibus at, diam."
"Painting, The (Tableau, Le)",Animation,http://dummyimage.com/240x180.png/ff4444/ffffff,2001,76,0.35,"In sagittis dui vel nisl. Duis ac nibh. Fusce lacus purus, aliquet at, feugiat non, pretium quis, lectus."
Wing Commander,Action|Sci-Fi,http://dummyimage.com/240x180.png/ff4444/ffffff,2005,170,0.33,"Cum sociis natoque penatibus et magnis dis parturient montes, nascetur ridiculus mus. Vivamus vestibulum sagittis sapien. Cum sociis natoque penatibus et magnis dis parturient montes, nascetur ridiculus mus."
To Mars by A-Bomb: The Secret History of Project Orion,Documentary,http://dummyimage.com/240x180.png/ff4444/ffffff,1993,181,0.95,"Vestibulum quam sapien, varius ut, blandit non, interdum in, ante. Vestibulum ante ipsum primis in faucibus orci luctus et ultrices posuere cubilia Curae; Duis faucibus accumsan odio. Curabitur convallis."
Sexmission (Seksmisja),Adventure|Comedy|Sci-Fi,http://dummyimage.com/240x180.png/ff4444/ffffff,2005,155,0.14,"Morbi non lectus. Aliquam sit amet diam in magna bibendum imperdiet. Nullam orci pede, venenatis non, sodales sed, tincidunt eu, felis."
The Violent Kind,Horror,http://dummyimage.com/240x180.png/5fa2dd/ffffff,1962,156,0.88,"Sed sagittis. Nam congue, risus semper porta volutpat, quam pede lobortis ligula, sit amet eleifend pede libero quis orci. Nullam molestie nibh in lectus."
Don't Drink the Water,Comedy,http://dummyimage.com/240x180.png/ff4444/ffffff,1998,153,0.31,"Maecenas tristique, est et tempus semper, est quam pharetra magna, ac consequat metus sapien ut nunc. Vestibulum ante ipsum primis in faucibus orci luctus et ultrices posuere cubilia Curae; Mauris viverra diam vitae quam. Suspendisse potenti."
American Reunion (American Pie 4),Comedy,http://dummyimage.com/240x180.png/dddddd/000000,2001,124,0.42,"Morbi porttitor lorem id ligula. Suspendisse ornare consequat lectus. In est risus, auctor sed, tristique in, tempus sit amet, sem."
"Sheik, The",Adventure|Drama|Romance,http://dummyimage.com/240x180.png/dddddd/000000,2005,131,0.45,"Cum sociis natoque penatibus et magnis dis parturient montes, nascetur ridiculus mus. Vivamus vestibulum sagittis sapien. Cum sociis natoque penatibus et magnis dis parturient montes, nascetur ridiculus mus."
Play Time (a.k.a. Playtime),Comedy,http://dummyimage.com/240x180.png/cc0000/ffffff,2002,147,0.74,"Curabitur in libero ut massa volutpat convallis. Morbi odio odio, elementum eu, interdum eu, tincidunt in, leo. Maecenas pulvinar lobortis est."
Flipper,Adventure|Children,http://dummyimage.com/240x180.png/cc0000/ffffff,2007,182,0.05,"Sed sagittis. Nam congue, risus semper porta volutpat, quam pede lobortis ligula, sit amet eleifend pede libero quis orci. Nullam molestie nibh in lectus."
The Case of the Lucky Legs,Comedy|Crime|Mystery,http://dummyimage.com/240x180.png/5fa2dd/ffffff,1995,97,0.55,Aenean lectus. Pellentesque eget nunc. Donec quis orci eget orci vehicula condimentum.
Peter Pan,Action|Adventure|Children|Fantasy,http://dummyimage.com/240x180.png/ff4444/ffffff,2006,120,0.5,Praesent id massa id nisl venenatis lacinia. Aenean sit amet justo. Morbi ut odio.
There Was a Father (Chichi ariki),Drama,http://dummyimage.com/240x180.png/5fa2dd/ffffff,2011,149,0.86,Suspendisse potenti. In eleifend quam a odio. In hac habitasse platea dictumst.
National Lampoon's Van Wilder: The Rise of Taj,Comedy,http://dummyimage.com/240x180.png/5fa2dd/ffffff,2004,178,0.26,Etiam vel augue. Vestibulum rutrum rutrum neque. Aenean auctor gravida sem.
Darkon,Documentary|Fantasy,http://dummyimage.com/240x180.png/ff4444/ffffff,1992,139,0.97,"Praesent blandit. Nam nulla. Integer pede justo, lacinia eget, tincidunt eget, tempus vel, pede."
"Bright Lights, Big City",Drama,http://dummyimage.com/240x180.png/dddddd/000000,1993,72,0.53,"Maecenas tristique, est et tempus semper, est quam pharetra magna, ac consequat metus sapien ut nunc. Vestibulum ante ipsum primis in faucibus orci luctus et ultrices posuere cubilia Curae; Mauris viverra diam vitae quam. Suspendisse potenti."
Life or Something Like It,Comedy|Romance,http://dummyimage.com/240x180.png/cc0000/ffffff,1999,134,0.04,"Quisque porta volutpat erat. Quisque erat eros, viverra eget, congue eget, semper rutrum, nulla. Nunc purus."
Los Flamencos,Comedy,http://dummyimage.com/240x180.png/5fa2dd/ffffff,2001,80,0.03,"Nam ultrices, libero non mattis pulvinar, nulla pede ullamcorper augue, a suscipit nulla elit ac nulla. Sed vel enim sit amet nunc viverra dapibus. Nulla suscipit ligula in lacus."
Dr. Who and the Daleks,Adventure|Children|Sci-Fi,http://dummyimage.com/240x180.png/dddddd/000000,2006,70,0.65,Cras non velit nec nisi vulputate nonummy. Maecenas tincidunt lacus at velit. Vivamus vel nulla eget eros elementum pellentesque.
"Trumpet of the Swan, The",Animation|Drama|Musical,http://dummyimage.com/240x180.png/cc0000/ffffff,2011,200,0.01,"Quisque porta volutpat erat. Quisque erat eros, viverra eget, congue eget, semper rutrum, nulla. Nunc purus."
Parental Guidance,Comedy,http://dummyimage.com/240x180.png/5fa2dd/ffffff,1995,150,0.73,"Proin eu mi. Nulla ac enim. In tempor, turpis nec euismod scelerisque, quam turpis adipiscing lorem, vitae mattis nibh ligula nec sem."
P.S. Your Cat is Dead,Comedy,http://dummyimage.com/240x180.png/dddddd/000000,2008,190,0.8,Nullam sit amet turpis elementum ligula vehicula consequat. Morbi a ipsum. Integer a nibh.
The Conrad Boys,Drama,http://dummyimage.com/240x180.png/cc0000/ffffff,2001,72,0.35,"Curabitur at ipsum ac tellus semper interdum. Mauris ullamcorper purus sit amet nulla. Quisque arcu libero, rutrum ac, lobortis vel, dapibus at, diam."
Sinbad (Szindbád),Drama,http://dummyimage.com/240x180.png/cc0000/ffffff,2008,121,0.1,Cras non velit nec nisi vulputate nonummy. Maecenas tincidunt lacus at velit. Vivamus vel nulla eget eros elementum pellentesque.
"Haunting in Connecticut, The",Horror|Thriller,http://dummyimage.com/240x180.png/cc0000/ffffff,1998,157,0.81,"Mauris enim leo, rhoncus sed, vestibulum sit amet, cursus id, turpis. Integer aliquet, massa id lobortis convallis, tortor risus dapibus augue, vel accumsan tellus nisi eu orci. Mauris lacinia sapien quis libero."
"Blue Max, The",Adventure|Drama|War,http://dummyimage.com/240x180.png/cc0000/ffffff,2007,113,0.16,"Sed sagittis. Nam congue, risus semper porta volutpat, quam pede lobortis ligula, sit amet eleifend pede libero quis orci. Nullam molestie nibh in lectus."
Ken Park,Drama,http://dummyimage.com/240x180.png/5fa2dd/ffffff,2005,189,0.22,"Mauris enim leo, rhoncus sed, vestibulum sit amet, cursus id, turpis. Integer aliquet, massa id lobortis convallis, tortor risus dapibus augue, vel accumsan tellus nisi eu orci. Mauris lacinia sapien quis libero."
Survival Island (Three),Adventure|Drama|Horror,http://dummyimage.com/240x180.png/cc0000/ffffff,2004,127,0.06,"Cum sociis natoque penatibus et magnis dis parturient montes, nascetur ridiculus mus. Vivamus vestibulum sagittis sapien. Cum sociis natoque penatibus et magnis dis parturient montes, nascetur ridiculus mus."
Tony Rome,Crime|Drama|Thriller,http://dummyimage.com/240x180.png/cc0000/ffffff,1997,92,0.4,Nullam sit amet turpis elementum ligula vehicula consequat. Morbi a ipsum. Integer a nibh.
Dacii,Drama|War,http://dummyimage.com/240x180.png/5fa2dd/ffffff,1994,91,0.48,Nulla ut erat id mauris vulputate elementum. Nullam varius. Nulla facilisi.
The Dust Bowl,Documentary,http://dummyimage.com/240x180.png/dddddd/000000,2010,164,0.94,Nullam sit amet turpis elementum ligula vehicula consequat. Morbi a ipsum. Integer a nibh.
Wesley Willis: The Daddy of Rock 'n' Roll,Documentary,http://dummyimage.com/240x180.png/5fa2dd/ffffff,1999,195,0.79,"Donec diam neque, vestibulum eget, vulputate ut, ultrices vel, augue. Vestibulum ante ipsum primis in faucibus orci luctus et ultrices posuere cubilia Curae; Donec pharetra, magna vestibulum aliquet ultrices, erat tortor sollicitudin mi, sit amet lobortis sapien sapien non mi. Integer ac neque."
Sunny (Sseo-ni),Drama,http://dummyimage.com/240x180.png/dddddd/000000,1990,183,0.03,Nullam sit amet turpis elementum ligula vehicula consequat. Morbi a ipsum. Integer a nibh.
I'll Follow You Down,Drama|Mystery|Sci-Fi,http://dummyimage.com/240x180.png/5fa2dd/ffffff,2000,175,0.69,"Donec diam neque, vestibulum eget, vulputate ut, ultrices vel, augue. Vestibulum ante ipsum primis in faucibus orci luctus et ultrices posuere cubilia Curae; Donec pharetra, magna vestibulum aliquet ultrices, erat tortor sollicitudin mi, sit amet lobortis sapien sapien non mi. Integer ac neque."
Winter War (Talvisota),Drama|War,http://dummyimage.com/240x180.png/cc0000/ffffff,2009,145,0.4,Aliquam quis turpis eget elit sodales scelerisque. Mauris sit amet eros. Suspendisse accumsan tortor quis turpis.
Ween Live in Chicago,Documentary,http://dummyimage.com/240x180.png/cc0000/ffffff,2002,131,0.38,Aenean lectus. Pellentesque eget nunc. Donec quis orci eget orci vehicula condimentum.
"Forsyte Saga, The",Drama,http://dummyimage.com/240x180.png/dddddd/000000,1995,171,0.57,Duis consequat dui nec nisi volutpat eleifend. Donec ut dolor. Morbi vel lectus in quam fringilla rhoncus.
DuckTales: The Movie - Treasure of the Lost Lamp,Adventure|Animation|Children|Comedy|Fantasy,http://dummyimage.com/240x180.png/cc0000/ffffff,2002,93,0.36,Pellentesque at nulla. Suspendisse potenti. Cras in purus eu magna vulputate luctus.
"Slums of Beverly Hills, The",Comedy|Drama,http://dummyimage.com/240x180.png/cc0000/ffffff,1989,96,0.06,"Vestibulum quam sapien, varius ut, blandit non, interdum in, ante. Vestibulum ante ipsum primis in faucibus orci luctus et ultrices posuere cubilia Curae; Duis faucibus accumsan odio. Curabitur convallis."
Mondovino,Documentary,http://dummyimage.com/240x180.png/5fa2dd/ffffff,2006,109,0.65,"Maecenas leo odio, condimentum id, luctus nec, molestie sed, justo. Pellentesque viverra pede ac diam. Cras pellentesque volutpat dui."
Defenseless,Thriller,http://dummyimage.com/240x180.png/ff4444/ffffff,1997,97,0.33,"Praesent blandit. Nam nulla. Integer pede justo, lacinia eget, tincidunt eget, tempus vel, pede."
Imaginaerum,Fantasy|Musical,http://dummyimage.com/240x180.png/dddddd/000000,1984,125,0.34,Aenean lectus. Pellentesque eget nunc. Donec quis orci eget orci vehicula condimentum.
Soft Shell Man (Un crabe dans la tête),Drama|Romance,http://dummyimage.com/240x180.png/dddddd/000000,2007,139,0.28,Duis bibendum. Morbi non quam nec dui luctus rutrum. Nulla tellus.
Pornstar: The Legend of Ron Jeremy,Documentary,http://dummyimage.com/240x180.png/dddddd/000000,2000,198,0.05,"In sagittis dui vel nisl. Duis ac nibh. Fusce lacus purus, aliquet at, feugiat non, pretium quis, lectus."
Goya: Crazy Like a Genius,Documentary,http://dummyimage.com/240x180.png/dddddd/000000,2008,77,0.46,"Duis bibendum, felis sed interdum venenatis, turpis enim blandit mi, in porttitor pede justo eu massa. Donec dapibus. Duis at velit eu est congue elementum."
Duplicity,Crime|Romance|Thriller,http://dummyimage.com/240x180.png/ff4444/ffffff,1987,146,0.78,Aenean lectus. Pellentesque eget nunc. Donec quis orci eget orci vehicula condimentum.
Man of the Year,Documentary,http://dummyimage.com/240x180.png/5fa2dd/ffffff,1998,89,0.88,In quis justo. Maecenas rhoncus aliquam lacus. Morbi quis tortor id nulla ultrices aliquet.
Big Star: Nothing Can Hurt Me,Documentary,http://dummyimage.com/240x180.png/ff4444/ffffff,2010,80,0.36,Aliquam quis turpis eget elit sodales scelerisque. Mauris sit amet eros. Suspendisse accumsan tortor quis turpis.
"Defender, The",Action,http://dummyimage.com/240x180.png/cc0000/ffffff,1994,174,0.24,Duis aliquam convallis nunc. Proin at turpis a pede posuere nonummy. Integer non velit.
Redline,Action,http://dummyimage.com/240x180.png/ff4444/ffffff,2006,161,0.94,"Quisque porta volutpat erat. Quisque erat eros, viverra eget, congue eget, semper rutrum, nulla. Nunc purus."
Runaway Train,Action|Adventure|Drama|Thriller,http://dummyimage.com/240x180.png/dddddd/000000,1997,108,0.49,Nullam porttitor lacus at turpis. Donec posuere metus vitae ipsum. Aliquam non mauris.
Kevin Smith: Burn in Hell,Comedy,http://dummyimage.com/240x180.png/dddddd/000000,2006,86,0.55,Cras non velit nec nisi vulputate nonummy. Maecenas tincidunt lacus at velit. Vivamus vel nulla eget eros elementum pellentesque.
Once Upon a Time (Der var engang),Romance,http://dummyimage.com/240x180.png/dddddd/000000,2007,174,0.73,"Mauris enim leo, rhoncus sed, vestibulum sit amet, cursus id, turpis. Integer aliquet, massa id lobortis convallis, tortor risus dapibus augue, vel accumsan tellus nisi eu orci. Mauris lacinia sapien quis libero."
Sherlock Holmes: Terror by Night,Crime|Mystery|Thriller,http://dummyimage.com/240x180.png/cc0000/ffffff,2002,122,0.44,Nullam porttitor lacus at turpis. Donec posuere metus vitae ipsum. Aliquam non mauris.
Summer School,Horror,http://dummyimage.com/240x180.png/cc0000/ffffff,2000,195,0.88,"Cum sociis natoque penatibus et magnis dis parturient montes, nascetur ridiculus mus. Vivamus vestibulum sagittis sapien. Cum sociis natoque penatibus et magnis dis parturient montes, nascetur ridiculus mus."
Bad Johnson,Comedy|Fantasy,http://dummyimage.com/240x180.png/ff4444/ffffff,2011,97,0.28,Nullam sit amet turpis elementum ligula vehicula consequat. Morbi a ipsum. Integer a nibh.
"Changeling, The",Horror|Mystery|Thriller,http://dummyimage.com/240x180.png/5fa2dd/ffffff,2009,145,0.31,"In hac habitasse platea dictumst. Morbi vestibulum, velit id pretium iaculis, diam erat fermentum justo, nec condimentum neque sapien placerat ante. Nulla justo."
By the People: The Election of Barack Obama,Documentary,http://dummyimage.com/240x180.png/ff4444/ffffff,2012,88,0.55,Suspendisse potenti. In eleifend quam a odio. In hac habitasse platea dictumst.
Anamorph,Crime|Thriller,http://dummyimage.com/240x180.png/cc0000/ffffff,1986,127,0.07,Integer tincidunt ante vel ipsum. Praesent blandit lacinia erat. Vestibulum sed magna at nunc commodo placerat.
Mobsters,Crime|Drama,http://dummyimage.com/240x180.png/cc0000/ffffff,2001,71,0.0,"Curabitur in libero ut massa volutpat convallis. Morbi odio odio, elementum eu, interdum eu, tincidunt in, leo. Maecenas pulvinar lobortis est."
Revenge,Drama|Romance|Thriller,http://dummyimage.com/240x180.png/5fa2dd/ffffff,1997,125,0.37,"Proin interdum mauris non ligula pellentesque ultrices. Phasellus id sapien in sapien iaculis congue. Vivamus metus arcu, adipiscing molestie, hendrerit at, vulputate vitae, nisl."
Wrestling Ernest Hemingway,Drama|Romance,http://dummyimage.com/240x180.png/ff4444/ffffff,2011,114,0.43,In congue. Etiam justo. Etiam pretium iaculis justo.
In the Name of the King III,Action|Adventure|Drama|Fantasy,http://dummyimage.com/240x180.png/ff4444/ffffff,2011,153,0.67,"Sed sagittis. Nam congue, risus semper porta volutpat, quam pede lobortis ligula, sit amet eleifend pede libero quis orci. Nullam molestie nibh in lectus."
Seance on a Wet Afternoon,Crime|Drama|Thriller,http://dummyimage.com/240x180.png/cc0000/ffffff,2009,173,0.59,"Maecenas tristique, est et tempus semper, est quam pharetra magna, ac consequat metus sapien ut nunc. Vestibulum ante ipsum primis in faucibus orci luctus et ultrices posuere cubilia Curae; Mauris viverra diam vitae quam. Suspendisse potenti."
Price of Glory,Drama,http://dummyimage.com/240x180.png/ff4444/ffffff,2006,153,0.53,Duis bibendum. Morbi non quam nec dui luctus rutrum. Nulla tellus.
"Missionary, The",Comedy,http://dummyimage.com/240x180.png/ff4444/ffffff,2001,108,0.45,Nulla ut erat id mauris vulputate elementum. Nullam varius. Nulla facilisi.
Full Moon High,Comedy|Fantasy|Horror,http://dummyimage.com/240x180.png/cc0000/ffffff,2008,175,0.26,"Quisque id justo sit amet sapien dignissim vestibulum. Vestibulum ante ipsum primis in faucibus orci luctus et ultrices posuere cubilia Curae; Nulla dapibus dolor vel est. Donec odio justo, sollicitudin ut, suscipit a, feugiat et, eros."
"Hand of Peace: Pope Pius XII and the Holocaust, A",Documentary,http://dummyimage.com/240x180.png/ff4444/ffffff,1961,123,0.5,In quis justo. Maecenas rhoncus aliquam lacus. Morbi quis tortor id nulla ultrices aliquet.
Slasher House,Horror,http://dummyimage.com/240x180.png/dddddd/000000,2006,91,0.39,"Fusce posuere felis sed lacus. Morbi sem mauris, laoreet ut, rhoncus aliquet, pulvinar sed, nisl. Nunc rhoncus dui vel sem."
Common Threads: Stories from the Quilt,Documentary,http://dummyimage.com/240x180.png/cc0000/ffffff,1996,115,0.13,"Quisque porta volutpat erat. Quisque erat eros, viverra eget, congue eget, semper rutrum, nulla. Nunc purus."
Operation Dumbo Drop,Action|Adventure|Comedy|War,http://dummyimage.com/240x180.png/cc0000/ffffff,1999,159,0.01,Aenean lectus. Pellentesque eget nunc. Donec quis orci eget orci vehicula condimentum.
Harlem Nights,Comedy|Crime|Romance,http://dummyimage.com/240x180.png/cc0000/ffffff,2007,90,0.07,Integer ac leo. Pellentesque ultrices mattis odio. Donec vitae nisi.
Bonjour Monsieur Shlomi (Ha-Kochavim Shel Shlomi),Comedy|Drama,http://dummyimage.com/240x180.png/ff4444/ffffff,2006,194,0.55,"Duis bibendum, felis sed interdum venenatis, turpis enim blandit mi, in porttitor pede justo eu massa. Donec dapibus. Duis at velit eu est congue elementum."
Devil's Knot,Crime|Drama|Thriller,http://dummyimage.com/240x180.png/5fa2dd/ffffff,1985,71,0.61,"Aenean fermentum. Donec ut mauris eget massa tempor convallis. Nulla neque libero, convallis eget, eleifend luctus, ultricies eu, nibh."
Ice Men,Drama,http://dummyimage.com/240x180.png/ff4444/ffffff,1996,144,0.58,Duis bibendum. Morbi non quam nec dui luctus rutrum. Nulla tellus.
Return of the Living Dead: Rave to the Grave,Comedy|Horror,http://dummyimage.com/240x180.png/dddddd/000000,1985,83,0.77,Fusce consequat. Nulla nisl. Nunc nisl.
Vizontele Tuuba,Comedy|Drama,http://dummyimage.com/240x180.png/cc0000/ffffff,2003,146,0.68,Integer tincidunt ante vel ipsum. Praesent blandit lacinia erat. Vestibulum sed magna at nunc commodo placerat.
Frank,Comedy|Drama|Mystery,http://dummyimage.com/240x180.png/cc0000/ffffff,2011,153,0.84,"Quisque porta volutpat erat. Quisque erat eros, viverra eget, congue eget, semper rutrum, nulla. Nunc purus."
"Best of Times, The (Mei li shi guang)",Crime|Drama|Thriller,http://dummyimage.com/240x180.png/5fa2dd/ffffff,1985,71,0.43,"Quisque id justo sit amet sapien dignissim vestibulum. Vestibulum ante ipsum primis in faucibus orci luctus et ultrices posuere cubilia Curae; Nulla dapibus dolor vel est. Donec odio justo, sollicitudin ut, suscipit a, feugiat et, eros."
Scandal Sheet,Crime|Drama|Film-Noir|Romance|Thriller,http://dummyimage.com/240x180.png/ff4444/ffffff,2002,78,0.01,Duis bibendum. Morbi non quam nec dui luctus rutrum. Nulla tellus.
Pandaemonium,Drama,http://dummyimage.com/240x180.png/5fa2dd/ffffff,2011,76,0.46,"Vestibulum quam sapien, varius ut, blandit non, interdum in, ante. Vestibulum ante ipsum primis in faucibus orci luctus et ultrices posuere cubilia Curae; Duis faucibus accumsan odio. Curabitur convallis."
Stranded: I've Come from a Plane That Crashed on the Mountains,Documentary,http://dummyimage.com/240x180.png/dddddd/000000,1996,159,0.67,Sed ante. Vivamus tortor. Duis mattis egestas metus.
I Became a Criminal (They Made Me a Fugitive),Crime|Drama|Film-Noir,http://dummyimage.com/240x180.png/5fa2dd/ffffff,1992,125,0.95,"In sagittis dui vel nisl. Duis ac nibh. Fusce lacus purus, aliquet at, feugiat non, pretium quis, lectus."
Christmas in Conway,Drama|Romance,http://dummyimage.com/240x180.png/ff4444/ffffff,1986,103,0.13,"Aenean fermentum. Donec ut mauris eget massa tempor convallis. Nulla neque libero, convallis eget, eleifend luctus, ultricies eu, nibh."
"Dance Party, USA",Drama,http://dummyimage.com/240x180.png/5fa2dd/ffffff,1996,170,0.73,"Maecenas tristique, est et tempus semper, est quam pharetra magna, ac consequat metus sapien ut nunc. Vestibulum ante ipsum primis in faucibus orci luctus et ultrices posuere cubilia Curae; Mauris viverra diam vitae quam. Suspendisse potenti."
Tonight You're Mine,Comedy|Drama,http://dummyimage.com/240x180.png/dddddd/000000,2009,129,0.4,"Morbi non lectus. Aliquam sit amet diam in magna bibendum imperdiet. Nullam orci pede, venenatis non, sodales sed, tincidunt eu, felis."
"Bone Man, The (Der Knochenmann)",Crime|Thriller,http://dummyimage.com/240x180.png/5fa2dd/ffffff,2009,161,0.26,In congue. Etiam justo. Etiam pretium iaculis justo.
Romasanta: The Werewolf Hunt,Drama|Horror|Mystery,http://dummyimage.com/240x180.png/5fa2dd/ffffff,2004,170,0.48,Duis aliquam convallis nunc. Proin at turpis a pede posuere nonummy. Integer non velit.
TerrorVision,Comedy|Horror|Sci-Fi,http://dummyimage.com/240x180.png/dddddd/000000,1992,148,0.22,Fusce consequat. Nulla nisl. Nunc nisl.
"Count Dracula (Nachts, wenn Dracula erwacht)",Horror|Mystery,http://dummyimage.com/240x180.png/cc0000/ffffff,2012,118,0.28,"In hac habitasse platea dictumst. Morbi vestibulum, velit id pretium iaculis, diam erat fermentum justo, nec condimentum neque sapien placerat ante. Nulla justo."
Alone (Issiz adam),Drama|Romance,http://dummyimage.com/240x180.png/cc0000/ffffff,1968,176,0.18,Integer tincidunt ante vel ipsum. Praesent blandit lacinia erat. Vestibulum sed magna at nunc commodo placerat.
Riddick,Action|Sci-Fi|Thriller|IMAX,http://dummyimage.com/240x180.png/dddddd/000000,2004,135,0.55,Phasellus sit amet erat. Nulla tempus. Vivamus in felis eu sapien cursus vestibulum.
Deadline at Dawn,Film-Noir|Mystery|Romance|Thriller,http://dummyimage.com/240x180.png/cc0000/ffffff,2006,186,0.31,Duis aliquam convallis nunc. Proin at turpis a pede posuere nonummy. Integer non velit.
"Front, The",Comedy|Drama,http://dummyimage.com/240x180.png/5fa2dd/ffffff,2005,147,0.58,"Curabitur in libero ut massa volutpat convallis. Morbi odio odio, elementum eu, interdum eu, tincidunt in, leo. Maecenas pulvinar lobortis est."
Cheyenne Autumn,Western,http://dummyimage.com/240x180.png/cc0000/ffffff,2010,166,0.82,"Nam ultrices, libero non mattis pulvinar, nulla pede ullamcorper augue, a suscipit nulla elit ac nulla. Sed vel enim sit amet nunc viverra dapibus. Nulla suscipit ligula in lacus."
Boom!,Drama,http://dummyimage.com/240x180.png/ff4444/ffffff,2009,106,0.89,"Vestibulum quam sapien, varius ut, blandit non, interdum in, ante. Vestibulum ante ipsum primis in faucibus orci luctus et ultrices posuere cubilia Curae; Duis faucibus accumsan odio. Curabitur convallis."
Dagon,Fantasy|Horror|Mystery|Thriller,http://dummyimage.com/240x180.png/ff4444/ffffff,2001,117,0.81,Duis bibendum. Morbi non quam nec dui luctus rutrum. Nulla tellus.
Never Met Picasso,Romance,http://dummyimage.com/240x180.png/5fa2dd/ffffff,2006,115,0.61,Sed ante. Vivamus tortor. Duis mattis egestas metus.
It's a Very Merry Muppet Christmas Movie,Children|Comedy,http://dummyimage.com/240x180.png/dddddd/000000,2012,98,0.86,Suspendisse potenti. In eleifend quam a odio. In hac habitasse platea dictumst.
Waist Deep,Action|Crime|Drama|Thriller,http://dummyimage.com/240x180.png/ff4444/ffffff,2004,141,0.56,Fusce consequat. Nulla nisl. Nunc nisl.
Love Life,Comedy|Romance,http://dummyimage.com/240x180.png/ff4444/ffffff,2004,112,0.58,Phasellus in felis. Donec semper sapien a libero. Nam dui.
30 Beats,Comedy|Romance,http://dummyimage.com/240x180.png/dddddd/000000,2002,88,0.61,"Proin eu mi. Nulla ac enim. In tempor, turpis nec euismod scelerisque, quam turpis adipiscing lorem, vitae mattis nibh ligula nec sem."
