title,genre,poster,year,duration,score,description
Jack and the Cuckoo-Clock Heart (Jack et la mécanique du coeur),Adventure|Animation|Drama|Fantasy|Musical|Romance,http://dummyimage.com/240x180.png/dddddd/000000,2008,182,0.86,"Curabitur at ipsum ac tellus semper interdum. Mauris ullamcorper purus sit amet nulla. Quisque arcu libero, rutrum ac, lobortis vel, dapibus at, diam."
Loner (Woetoli),Horror|Thriller,http://dummyimage.com/240x180.png/5fa2dd/ffffff,1997,197,0.75,"Sed sagittis. Nam congue, risus semper porta volutpat, quam pede lobortis ligula, sit amet eleifend pede libero quis orci. Nullam molestie nibh in lectus."
New Scenes from America,Documentary,http://dummyimage.com/240x180.png/cc0000/ffffff,2005,127,0.37,Phasellus sit amet erat. Nulla tempus. Vivamus in felis eu sapien cursus vestibulum.
Everything,Drama|Mystery,http://dummyimage.com/240x180.png/dddddd/000000,1995,148,0.16,"In hac habitasse platea dictumst. Morbi vestibulum, velit id pretium iaculis, diam erat fermentum justo, nec condimentum neque sapien placerat ante. Nulla justo."
Wild Zero,Action|Comedy|Horror|Romance|Sci-Fi,http://dummyimage.com/240x180.png/ff4444/ffffff,1989,172,0.91,"Quisque id justo sit amet sapien dignissim vestibulum. Vestibulum ante ipsum primis in faucibus orci luctus et ultrices posuere cubilia Curae; Nulla dapibus dolor vel est. Donec odio justo, sollicitudin ut, suscipit a, feugiat et, eros."
Galaxy Quest,Adventure|Comedy|Sci-Fi,http://dummyimage.com/240x180.png/ff4444/ffffff,2007,191,0.52,Nullam porttitor lacus at turpis. Donec posuere metus vitae ipsum. Aliquam non mauris.
Max Dugan Returns,Comedy,http://dummyimage.com/240x180.png/ff4444/ffffff,2010,96,0.93,"Proin eu mi. Nulla ac enim. In tempor, turpis nec euismod scelerisque, quam turpis adipiscing lorem, vitae mattis nibh ligula nec sem."
Crazy/Beautiful,Drama|Romance,http://dummyimage.com/240x180.png/ff4444/ffffff,1983,128,0.36,In congue. Etiam justo. Etiam pretium iaculis justo.
Lemonade Joe (Limonádový Joe aneb Konská opera),Adventure|Comedy|Musical|Romance|Western,http://dummyimage.com/240x180.png/ff4444/ffffff,1993,132,0.26,Phasellus sit amet erat. Nulla tempus. Vivamus in felis eu sapien cursus vestibulum.
"Reincarnation of Peter Proud, The",Horror|Mystery,http://dummyimage.com/240x180.png/dddddd/000000,2000,190,0.92,In quis justo. Maecenas rhoncus aliquam lacus. Morbi quis tortor id nulla ultrices aliquet.
"Mask of Fu Manchu, The",Adventure|Horror|Sci-Fi,http://dummyimage.com/240x180.png/cc0000/ffffff,2001,90,0.91,"Donec diam neque, vestibulum eget, vulputate ut, ultrices vel, augue. Vestibulum ante ipsum primis in faucibus orci luctus et ultrices posuere cubilia Curae; Donec pharetra, magna vestibulum aliquet ultrices, erat tortor sollicitudin mi, sit amet lobortis sapien sapien non mi. Integer ac neque."
Dutch,Comedy,http://dummyimage.com/240x180.png/ff4444/ffffff,2003,178,0.46,Maecenas ut massa quis augue luctus tincidunt. Nulla mollis molestie lorem. Quisque ut erat.
Witch Hunt,Documentary,http://dummyimage.com/240x180.png/5fa2dd/ffffff,2000,188,0.23,"Duis bibendum, felis sed interdum venenatis, turpis enim blandit mi, in porttitor pede justo eu massa. Donec dapibus. Duis at velit eu est congue elementum."
"Miss and the Doctors (Tirez la langue, mademoiselle)",Drama|Romance,http://dummyimage.com/240x180.png/dddddd/000000,2010,73,0.94,Etiam vel augue. Vestibulum rutrum rutrum neque. Aenean auctor gravida sem.
Don't Blink,Horror|Mystery|Sci-Fi,http://dummyimage.com/240x180.png/cc0000/ffffff,1991,138,1.0,In hac habitasse platea dictumst. Etiam faucibus cursus urna. Ut tellus.
Tango,Drama|Musical,http://dummyimage.com/240x180.png/dddddd/000000,2011,138,0.6,Nullam sit amet turpis elementum ligula vehicula consequat. Morbi a ipsum. Integer a nibh.
Watch on the Rhine,Drama,http://dummyimage.com/240x180.png/dddddd/000000,1998,119,0.27,Nullam sit amet turpis elementum ligula vehicula consequat. Morbi a ipsum. Integer a nibh.
Uprise,Drama,http://dummyimage.com/240x180.png/ff4444/ffffff,1985,144,0.59,Cras non velit nec nisi vulputate nonummy. Maecenas tincidunt lacus at velit. Vivamus vel nulla eget eros elementum pellentesque.
Jennifer 8,Mystery|Thriller,http://dummyimage.com/240x180.png/cc0000/ffffff,2012,106,0.99,Praesent id massa id nisl venenatis lacinia. Aenean sit amet justo. Morbi ut odio.
"Cave of the Yellow Dog, The",Drama,http://dummyimage.com/240x180.png/cc0000/ffffff,2012,114,0.7,Integer ac leo. Pellentesque ultrices mattis odio. Donec vitae nisi.
"Filth and the Fury, The",Documentary,http://dummyimage.com/240x180.png/dddddd/000000,1999,144,0.45,"Fusce posuere felis sed lacus. Morbi sem mauris, laoreet ut, rhoncus aliquet, pulvinar sed, nisl. Nunc rhoncus dui vel sem."
Woman Obsessed,Drama|Romance,http://dummyimage.com/240x180.png/cc0000/ffffff,2007,88,0.26,In quis justo. Maecenas rhoncus aliquam lacus. Morbi quis tortor id nulla ultrices aliquet.
"Bitter Tears of Petra von Kant, The (bitteren Tränen der Petra von Kant, Die)",Drama,http://dummyimage.com/240x180.png/cc0000/ffffff,1995,82,0.69,"Nam ultrices, libero non mattis pulvinar, nulla pede ullamcorper augue, a suscipit nulla elit ac nulla. Sed vel enim sit amet nunc viverra dapibus. Nulla suscipit ligula in lacus."
Blind Mountain (Mang shan),Drama,http://dummyimage.com/240x180.png/5fa2dd/ffffff,1993,164,0.58,"Proin interdum mauris non ligula pellentesque ultrices. Phasellus id sapien in sapien iaculis congue. Vivamus metus arcu, adipiscing molestie, hendrerit at, vulputate vitae, nisl."
"Heat, The",Action|Comedy|Crime,http://dummyimage.com/240x180.png/cc0000/ffffff,2005,114,0.5,"Cras mi pede, malesuada in, imperdiet et, commodo vulputate, justo. In blandit ultrices enim. Lorem ipsum dolor sit amet, consectetuer adipiscing elit."
"Horror Hotel (a.k.a. City of the Dead, The)",Horror|Thriller,http://dummyimage.com/240x180.png/dddddd/000000,1993,171,0.92,Cras non velit nec nisi vulputate nonummy. Maecenas tincidunt lacus at velit. Vivamus vel nulla eget eros elementum pellentesque.
Dead End,Crime|Drama,http://dummyimage.com/240x180.png/dddddd/000000,2003,106,0.83,"Aenean fermentum. Donec ut mauris eget massa tempor convallis. Nulla neque libero, convallis eget, eleifend luctus, ultricies eu, nibh."
Munyurangabo,Drama,http://dummyimage.com/240x180.png/dddddd/000000,2009,190,0.54,"Vestibulum ac est lacinia nisi venenatis tristique. Fusce congue, diam id ornare imperdiet, sapien urna pretium nisl, ut volutpat sapien arcu sed augue. Aliquam erat volutpat."
"Girl with the Dragon Tattoo, The (Män som hatar kvinnor)",Crime|Drama|Mystery|Thriller,http://dummyimage.com/240x180.png/dddddd/000000,1999,110,0.32,"Sed sagittis. Nam congue, risus semper porta volutpat, quam pede lobortis ligula, sit amet eleifend pede libero quis orci. Nullam molestie nibh in lectus."
Cet amour-là,Drama|Romance,http://dummyimage.com/240x180.png/dddddd/000000,2009,196,0.72,"In hac habitasse platea dictumst. Morbi vestibulum, velit id pretium iaculis, diam erat fermentum justo, nec condimentum neque sapien placerat ante. Nulla justo."
"Letter to Elia, A",Documentary,http://dummyimage.com/240x180.png/cc0000/ffffff,2009,76,0.14,Duis bibendum. Morbi non quam nec dui luctus rutrum. Nulla tellus.
Cottage Country,Action|Comedy|Crime,http://dummyimage.com/240x180.png/dddddd/000000,1992,169,0.24,Fusce consequat. Nulla nisl. Nunc nisl.
You Got Served,Drama|Musical,http://dummyimage.com/240x180.png/5fa2dd/ffffff,1993,134,0.61,Suspendisse potenti. In eleifend quam a odio. In hac habitasse platea dictumst.
Slaves of New York,Drama,http://dummyimage.com/240x180.png/cc0000/ffffff,2004,73,0.71,In congue. Etiam justo. Etiam pretium iaculis justo.
Starcrash (a.k.a. Star Crash),Action|Adventure|Fantasy|Sci-Fi,http://dummyimage.com/240x180.png/dddddd/000000,2012,71,0.12,Cras non velit nec nisi vulputate nonummy. Maecenas tincidunt lacus at velit. Vivamus vel nulla eget eros elementum pellentesque.
On Golden Pond,Drama,http://dummyimage.com/240x180.png/5fa2dd/ffffff,2006,107,0.86,Maecenas ut massa quis augue luctus tincidunt. Nulla mollis molestie lorem. Quisque ut erat.
"Letter to Elia, A",Documentary,http://dummyimage.com/240x180.png/dddddd/000000,2000,139,0.47,"Nam ultrices, libero non mattis pulvinar, nulla pede ullamcorper augue, a suscipit nulla elit ac nulla. Sed vel enim sit amet nunc viverra dapibus. Nulla suscipit ligula in lacus."
Cleopatra,Drama|Romance|War,http://dummyimage.com/240x180.png/5fa2dd/ffffff,1994,116,0.89,Nullam porttitor lacus at turpis. Donec posuere metus vitae ipsum. Aliquam non mauris.
"Out of the Furnace (Dust to Dust) (Low Dweller, The)",Drama|Thriller,http://dummyimage.com/240x180.png/5fa2dd/ffffff,1998,179,0.62,"Proin leo odio, porttitor id, consequat in, consequat ut, nulla. Sed accumsan felis. Ut at dolor quis odio consequat varius."
As Good as Dead,Thriller,http://dummyimage.com/240x180.png/cc0000/ffffff,2010,126,0.16,Nullam sit amet turpis elementum ligula vehicula consequat. Morbi a ipsum. Integer a nibh.
Spring Breakdown,Comedy,http://dummyimage.com/240x180.png/5fa2dd/ffffff,2006,84,0.37,"In sagittis dui vel nisl. Duis ac nibh. Fusce lacus purus, aliquet at, feugiat non, pretium quis, lectus."
"Gravedancers, The",Horror|Thriller,http://dummyimage.com/240x180.png/cc0000/ffffff,2008,155,0.95,Aliquam quis turpis eget elit sodales scelerisque. Mauris sit amet eros. Suspendisse accumsan tortor quis turpis.
Vera Cruz,Adventure|Western,http://dummyimage.com/240x180.png/5fa2dd/ffffff,1996,199,0.75,Pellentesque at nulla. Suspendisse potenti. Cras in purus eu magna vulputate luctus.
Vermont Is For Lovers,Comedy|Documentary|Romance,http://dummyimage.com/240x180.png/5fa2dd/ffffff,1992,168,0.76,Nullam sit amet turpis elementum ligula vehicula consequat. Morbi a ipsum. Integer a nibh.
Journey to the Center of the Earth,Action|Children|Fantasy|Sci-Fi,http://dummyimage.com/240x180.png/ff4444/ffffff,2008,193,0.54,"Vestibulum ac est lacinia nisi venenatis tristique. Fusce congue, diam id ornare imperdiet, sapien urna pretium nisl, ut volutpat sapien arcu sed augue. Aliquam erat volutpat."
"Princess and the Pirate, The",Adventure|Comedy|Romance,http://dummyimage.com/240x180.png/5fa2dd/ffffff,2005,187,0.27,Duis consequat dui nec nisi volutpat eleifend. Donec ut dolor. Morbi vel lectus in quam fringilla rhoncus.
Superman Returns,Action|Adventure|Sci-Fi|IMAX,http://dummyimage.com/240x180.png/ff4444/ffffff,2011,192,0.89,"Curabitur gravida nisi at nibh. In hac habitasse platea dictumst. Aliquam augue quam, sollicitudin vitae, consectetuer eget, rutrum at, lorem."
Stray Cat Rock: Sex Hunter (Nora-neko rokku: Sekkusu hanta),Crime,http://dummyimage.com/240x180.png/ff4444/ffffff,2008,176,0.13,Pellentesque at nulla. Suspendisse potenti. Cras in purus eu magna vulputate luctus.
"Goddess, The",Drama,http://dummyimage.com/240x180.png/ff4444/ffffff,1997,108,0.01,Nullam porttitor lacus at turpis. Donec posuere metus vitae ipsum. Aliquam non mauris.
"Crimson Wing: Mystery of the Flamingos, The",Documentary,http://dummyimage.com/240x180.png/ff4444/ffffff,2007,90,0.48,"In sagittis dui vel nisl. Duis ac nibh. Fusce lacus purus, aliquet at, feugiat non, pretium quis, lectus."
Record of a Tenement Gentleman (Nagaya shinshiroku),Drama,http://dummyimage.com/240x180.png/dddddd/000000,1986,106,0.8,"Cum sociis natoque penatibus et magnis dis parturient montes, nascetur ridiculus mus. Vivamus vestibulum sagittis sapien. Cum sociis natoque penatibus et magnis dis parturient montes, nascetur ridiculus mus."
Never Forever,Drama|Romance,http://dummyimage.com/240x180.png/ff4444/ffffff,2007,108,0.56,In congue. Etiam justo. Etiam pretium iaculis justo.
"Eye Above the Well, The (Het oog boven de put)",Documentary,http://dummyimage.com/240x180.png/cc0000/ffffff,1997,97,0.37,"Maecenas leo odio, condimentum id, luctus nec, molestie sed, justo. Pellentesque viverra pede ac diam. Cras pellentesque volutpat dui."
Into Great Silence (Die große Stille),Documentary,http://dummyimage.com/240x180.png/ff4444/ffffff,2002,96,0.78,Duis consequat dui nec nisi volutpat eleifend. Donec ut dolor. Morbi vel lectus in quam fringilla rhoncus.
Heidi Fleiss: Hollywood Madam,Documentary,http://dummyimage.com/240x180.png/ff4444/ffffff,2002,146,0.49,Etiam vel augue. Vestibulum rutrum rutrum neque. Aenean auctor gravida sem.
Troma's War ,Action|Adventure|Comedy,http://dummyimage.com/240x180.png/dddddd/000000,2005,168,0.53,Aenean lectus. Pellentesque eget nunc. Donec quis orci eget orci vehicula condimentum.
Wrong Cops,Comedy|Crime,http://dummyimage.com/240x180.png/5fa2dd/ffffff,2013,131,0.22,"Proin eu mi. Nulla ac enim. In tempor, turpis nec euismod scelerisque, quam turpis adipiscing lorem, vitae mattis nibh ligula nec sem."
Virtuality,Drama|Sci-Fi|Thriller,http://dummyimage.com/240x180.png/cc0000/ffffff,1996,123,0.05,Pellentesque at nulla. Suspendisse potenti. Cras in purus eu magna vulputate luctus.
Gregory's Girl,Comedy|Romance,http://dummyimage.com/240x180.png/ff4444/ffffff,1985,158,0.47,Suspendisse potenti. In eleifend quam a odio. In hac habitasse platea dictumst.
"Damsel in Distress, A",Comedy|Musical|Romance,http://dummyimage.com/240x180.png/ff4444/ffffff,1972,108,0.37,"Cras mi pede, malesuada in, imperdiet et, commodo vulputate, justo. In blandit ultrices enim. Lorem ipsum dolor sit amet, consectetuer adipiscing elit."
"Hard Day's Night, A",Adventure|Comedy|Musical,http://dummyimage.com/240x180.png/dddddd/000000,2004,123,0.73,Duis aliquam convallis nunc. Proin at turpis a pede posuere nonummy. Integer non velit.
White Man's Burden,Drama,http://dummyimage.com/240x180.png/cc0000/ffffff,2004,151,0.69,Cras non velit nec nisi vulputate nonummy. Maecenas tincidunt lacus at velit. Vivamus vel nulla eget eros elementum pellentesque.
Zombieland,Action|Comedy|Horror,http://dummyimage.com/240x180.png/ff4444/ffffff,2012,135,0.65,Sed ante. Vivamus tortor. Duis mattis egestas metus.
Map of the Human Heart,Drama|Romance,http://dummyimage.com/240x180.png/ff4444/ffffff,1991,166,0.03,"In sagittis dui vel nisl. Duis ac nibh. Fusce lacus purus, aliquet at, feugiat non, pretium quis, lectus."
"Hills Have Eyes Part II, The",Horror,http://dummyimage.com/240x180.png/dddddd/000000,1993,156,0.8,"Cras mi pede, malesuada in, imperdiet et, commodo vulputate, justo. In blandit ultrices enim. Lorem ipsum dolor sit amet, consectetuer adipiscing elit."
Mama,Horror,http://dummyimage.com/240x180.png/ff4444/ffffff,1992,128,0.87,Cras non velit nec nisi vulputate nonummy. Maecenas tincidunt lacus at velit. Vivamus vel nulla eget eros elementum pellentesque.
Angel of Death,Action|Crime|Thriller,http://dummyimage.com/240x180.png/5fa2dd/ffffff,2010,136,0.39,Fusce consequat. Nulla nisl. Nunc nisl.
Castle of Blood,Horror,http://dummyimage.com/240x180.png/dddddd/000000,1996,135,0.43,Pellentesque at nulla. Suspendisse potenti. Cras in purus eu magna vulputate luctus.
"Season for Miracles, A",Children|Romance,http://dummyimage.com/240x180.png/dddddd/000000,1993,198,0.56,"Morbi non lectus. Aliquam sit amet diam in magna bibendum imperdiet. Nullam orci pede, venenatis non, sodales sed, tincidunt eu, felis."
Pusher II: With Blood on My Hands,Action|Crime|Drama|Thriller,http://dummyimage.com/240x180.png/dddddd/000000,1990,135,0.07,"Fusce posuere felis sed lacus. Morbi sem mauris, laoreet ut, rhoncus aliquet, pulvinar sed, nisl. Nunc rhoncus dui vel sem."
"Jo Jo Dancer, Your Life is Calling",Drama,http://dummyimage.com/240x180.png/dddddd/000000,1991,103,0.28,"Donec diam neque, vestibulum eget, vulputate ut, ultrices vel, augue. Vestibulum ante ipsum primis in faucibus orci luctus et ultrices posuere cubilia Curae; Donec pharetra, magna vestibulum aliquet ultrices, erat tortor sollicitudin mi, sit amet lobortis sapien sapien non mi. Integer ac neque."
Nico Icon,Documentary,http://dummyimage.com/240x180.png/cc0000/ffffff,1989,88,0.53,Integer tincidunt ante vel ipsum. Praesent blandit lacinia erat. Vestibulum sed magna at nunc commodo placerat.
Ward 13,Action|Animation|Comedy|Horror,http://dummyimage.com/240x180.png/5fa2dd/ffffff,1992,80,0.13,Aliquam quis turpis eget elit sodales scelerisque. Mauris sit amet eros. Suspendisse accumsan tortor quis turpis.
"Green Butchers, The (Grønne slagtere, De)",Comedy|Crime|Drama|Romance,http://dummyimage.com/240x180.png/dddddd/000000,1993,107,0.08,"Donec diam neque, vestibulum eget, vulputate ut, ultrices vel, augue. Vestibulum ante ipsum primis in faucibus orci luctus et ultrices posuere cubilia Curae; Donec pharetra, magna vestibulum aliquet ultrices, erat tortor sollicitudin mi, sit amet lobortis sapien sapien non mi. Integer ac neque."
"Signal, The",Sci-Fi|Thriller,http://dummyimage.com/240x180.png/5fa2dd/ffffff,2007,125,0.9,"Vestibulum quam sapien, varius ut, blandit non, interdum in, ante. Vestibulum ante ipsum primis in faucibus orci luctus et ultrices posuere cubilia Curae; Duis faucibus accumsan odio. Curabitur convallis."
Zhou Yu's Train (Zhou Yu de huo che),Drama|Romance,http://dummyimage.com/240x180.png/dddddd/000000,1994,170,0.64,Duis consequat dui nec nisi volutpat eleifend. Donec ut dolor. Morbi vel lectus in quam fringilla rhoncus.
Metro,Action|Comedy|Crime|Drama|Thriller,http://dummyimage.com/240x180.png/5fa2dd/ffffff,1993,148,0.71,"Mauris enim leo, rhoncus sed, vestibulum sit amet, cursus id, turpis. Integer aliquet, massa id lobortis convallis, tortor risus dapibus augue, vel accumsan tellus nisi eu orci. Mauris lacinia sapien quis libero."
I Don't Want to Talk About It (De eso no se habla),Drama|Romance,http://dummyimage.com/240x180.png/ff4444/ffffff,2012,166,0.74,"Nam ultrices, libero non mattis pulvinar, nulla pede ullamcorper augue, a suscipit nulla elit ac nulla. Sed vel enim sit amet nunc viverra dapibus. Nulla suscipit ligula in lacus."
Frankenstein,Drama|Horror|Sci-Fi,http://dummyimage.com/240x180.png/dddddd/000000,1992,131,0.37,"Lorem ipsum dolor sit amet, consectetuer adipiscing elit. Proin risus. Praesent lectus."
Tie Me Up! Tie Me Down! (¡Átame!),Crime|Drama|Romance,http://dummyimage.com/240x180.png/5fa2dd/ffffff,2000,70,0.51,Suspendisse potenti. In eleifend quam a odio. In hac habitasse platea dictumst.
All the Little Animals,Drama|Thriller,http://dummyimage.com/240x180.png/dddddd/000000,2008,121,0.42,"Curabitur gravida nisi at nibh. In hac habitasse platea dictumst. Aliquam augue quam, sollicitudin vitae, consectetuer eget, rutrum at, lorem."
"Sleepy Time Gal, The",Drama,http://dummyimage.com/240x180.png/5fa2dd/ffffff,1985,169,0.52,Nullam sit amet turpis elementum ligula vehicula consequat. Morbi a ipsum. Integer a nibh.
"Unforgiven, The",Drama|Western,http://dummyimage.com/240x180.png/5fa2dd/ffffff,2012,128,0.88,In congue. Etiam justo. Etiam pretium iaculis justo.
Robots,Adventure|Animation|Children|Comedy|Fantasy|Sci-Fi|IMAX,http://dummyimage.com/240x180.png/dddddd/000000,2008,199,0.99,"Quisque porta volutpat erat. Quisque erat eros, viverra eget, congue eget, semper rutrum, nulla. Nunc purus."
"Reality of Love, The (I Want to Marry Ryan Banks)",Comedy|Romance,http://dummyimage.com/240x180.png/dddddd/000000,2005,97,0.54,"Morbi porttitor lorem id ligula. Suspendisse ornare consequat lectus. In est risus, auctor sed, tristique in, tempus sit amet, sem."
"Death King, The (Der Todesking)",Drama|Horror,http://dummyimage.com/240x180.png/dddddd/000000,2004,176,0.09,Nullam sit amet turpis elementum ligula vehicula consequat. Morbi a ipsum. Integer a nibh.
"Legend of Bagger Vance, The",Drama|Romance,http://dummyimage.com/240x180.png/5fa2dd/ffffff,2004,200,0.37,"Proin leo odio, porttitor id, consequat in, consequat ut, nulla. Sed accumsan felis. Ut at dolor quis odio consequat varius."
"Night Visitor, The",Crime|Thriller,http://dummyimage.com/240x180.png/dddddd/000000,2012,118,0.65,Integer tincidunt ante vel ipsum. Praesent blandit lacinia erat. Vestibulum sed magna at nunc commodo placerat.
Gangster Squad,Action|Crime|Drama,http://dummyimage.com/240x180.png/dddddd/000000,2011,173,0.73,"Nam ultrices, libero non mattis pulvinar, nulla pede ullamcorper augue, a suscipit nulla elit ac nulla. Sed vel enim sit amet nunc viverra dapibus. Nulla suscipit ligula in lacus."
"Third Wheel, The",Comedy|Romance,http://dummyimage.com/240x180.png/cc0000/ffffff,2005,190,0.87,"In hac habitasse platea dictumst. Morbi vestibulum, velit id pretium iaculis, diam erat fermentum justo, nec condimentum neque sapien placerat ante. Nulla justo."
Switch,Comedy|Crime|Fantasy,http://dummyimage.com/240x180.png/dddddd/000000,1986,101,0.71,Duis bibendum. Morbi non quam nec dui luctus rutrum. Nulla tellus.
Late Chrysanthemums (Bangiku),Drama,http://dummyimage.com/240x180.png/cc0000/ffffff,1996,78,0.96,"Cras mi pede, malesuada in, imperdiet et, commodo vulputate, justo. In blandit ultrices enim. Lorem ipsum dolor sit amet, consectetuer adipiscing elit."
"Hamlet, Prince of Denmark",Drama,http://dummyimage.com/240x180.png/cc0000/ffffff,1986,106,0.66,Phasellus in felis. Donec semper sapien a libero. Nam dui.
Carbine Williams,Crime|Drama,http://dummyimage.com/240x180.png/5fa2dd/ffffff,2001,122,0.88,"Donec diam neque, vestibulum eget, vulputate ut, ultrices vel, augue. Vestibulum ante ipsum primis in faucibus orci luctus et ultrices posuere cubilia Curae; Donec pharetra, magna vestibulum aliquet ultrices, erat tortor sollicitudin mi, sit amet lobortis sapien sapien non mi. Integer ac neque."
Citizen Cohn,Drama,http://dummyimage.com/240x180.png/5fa2dd/ffffff,2004,192,0.8,"In hac habitasse platea dictumst. Morbi vestibulum, velit id pretium iaculis, diam erat fermentum justo, nec condimentum neque sapien placerat ante. Nulla justo."
Commando,Action|Adventure,http://dummyimage.com/240x180.png/5fa2dd/ffffff,1996,180,1.0,Nullam sit amet turpis elementum ligula vehicula consequat. Morbi a ipsum. Integer a nibh.
"Killing of Sister George, The",Drama,http://dummyimage.com/240x180.png/ff4444/ffffff,2011,148,0.07,"Maecenas tristique, est et tempus semper, est quam pharetra magna, ac consequat metus sapien ut nunc. Vestibulum ante ipsum primis in faucibus orci luctus et ultrices posuere cubilia Curae; Mauris viverra diam vitae quam. Suspendisse potenti."
This Movie Is Broken,Drama|Romance,http://dummyimage.com/240x180.png/dddddd/000000,2005,130,0.12,"Lorem ipsum dolor sit amet, consectetuer adipiscing elit. Proin risus. Praesent lectus."
Tank on the Moon,Documentary,http://dummyimage.com/240x180.png/ff4444/ffffff,2005,76,0.49,"Proin eu mi. Nulla ac enim. In tempor, turpis nec euismod scelerisque, quam turpis adipiscing lorem, vitae mattis nibh ligula nec sem."
Lies and Illusions,Action|Comedy|Thriller,http://dummyimage.com/240x180.png/cc0000/ffffff,1998,100,0.77,"Cum sociis natoque penatibus et magnis dis parturient montes, nascetur ridiculus mus. Vivamus vestibulum sagittis sapien. Cum sociis natoque penatibus et magnis dis parturient montes, nascetur ridiculus mus."
Manny & Lo,Drama,http://dummyimage.com/240x180.png/cc0000/ffffff,2000,198,0.48,Duis bibendum. Morbi non quam nec dui luctus rutrum. Nulla tellus.
Best Man Down,Drama,http://dummyimage.com/240x180.png/dddddd/000000,2007,108,0.4,Duis consequat dui nec nisi volutpat eleifend. Donec ut dolor. Morbi vel lectus in quam fringilla rhoncus.
Whiplash,Drama,http://dummyimage.com/240x180.png/ff4444/ffffff,1997,188,0.94,"Fusce posuere felis sed lacus. Morbi sem mauris, laoreet ut, rhoncus aliquet, pulvinar sed, nisl. Nunc rhoncus dui vel sem."
"Boys of St. Vincent, The",Drama,http://dummyimage.com/240x180.png/5fa2dd/ffffff,1990,112,0.18,Phasellus in felis. Donec semper sapien a libero. Nam dui.
Symphony of the Soil,Adventure|Documentary,http://dummyimage.com/240x180.png/ff4444/ffffff,1981,131,0.28,In congue. Etiam justo. Etiam pretium iaculis justo.
Carnosaur,Horror|Sci-Fi,http://dummyimage.com/240x180.png/ff4444/ffffff,1994,84,0.78,"Curabitur at ipsum ac tellus semper interdum. Mauris ullamcorper purus sit amet nulla. Quisque arcu libero, rutrum ac, lobortis vel, dapibus at, diam."
Tampopo,Comedy,http://dummyimage.com/240x180.png/ff4444/ffffff,2011,170,0.63,"Quisque porta volutpat erat. Quisque erat eros, viverra eget, congue eget, semper rutrum, nulla. Nunc purus."
The Derby Stallion,Children|Drama,http://dummyimage.com/240x180.png/5fa2dd/ffffff,1994,151,0.1,Aliquam quis turpis eget elit sodales scelerisque. Mauris sit amet eros. Suspendisse accumsan tortor quis turpis.
Going the Distance,Comedy,http://dummyimage.com/240x180.png/ff4444/ffffff,2000,169,0.86,"Donec diam neque, vestibulum eget, vulputate ut, ultrices vel, augue. Vestibulum ante ipsum primis in faucibus orci luctus et ultrices posuere cubilia Curae; Donec pharetra, magna vestibulum aliquet ultrices, erat tortor sollicitudin mi, sit amet lobortis sapien sapien non mi. Integer ac neque."
"Pit and the Pendulum, The",Horror,http://dummyimage.com/240x180.png/ff4444/ffffff,2001,118,0.27,Cras non velit nec nisi vulputate nonummy. Maecenas tincidunt lacus at velit. Vivamus vel nulla eget eros elementum pellentesque.
"Princess and the Goblin, The",Animation|Fantasy,http://dummyimage.com/240x180.png/5fa2dd/ffffff,1994,184,0.74,In congue. Etiam justo. Etiam pretium iaculis justo.
In the Realms of the Unreal,Animation|Documentary,http://dummyimage.com/240x180.png/5fa2dd/ffffff,2011,102,0.12,"Curabitur gravida nisi at nibh. In hac habitasse platea dictumst. Aliquam augue quam, sollicitudin vitae, consectetuer eget, rutrum at, lorem."
Healing,Drama,http://dummyimage.com/240x180.png/5fa2dd/ffffff,2008,175,0.25,"Cum sociis natoque penatibus et magnis dis parturient montes, nascetur ridiculus mus. Vivamus vestibulum sagittis sapien. Cum sociis natoque penatibus et magnis dis parturient montes, nascetur ridiculus mus."
Playing,Documentary,http://dummyimage.com/240x180.png/5fa2dd/ffffff,1960,117,0.93,Duis aliquam convallis nunc. Proin at turpis a pede posuere nonummy. Integer non velit.
